	index	Datum uitspraak:	Datum publicatie:	Rechtsgebieden:	Bijzondere kenmerken:	Vindplaatsen:	Inhoudsindicatie:	Formele relaties:
0	https://uitspraken.rechtspraak.nl/inziendocument?id=ECLI:NL:RBDHA:2022:11716&showbutton=true	09-11-2022	09-11-2022	Civiel recht	Kort geding	Rechtspraak.nl	Kort geding. Vordering om Staat te verbieden eiser uit te leveren aan Australië en/of nader onderzoek te doen of nadere garanties te vragen afgewezen. Geen reëel risico op een levenslange gevangenisstraf na uitlevering. Vordering tot afgifte van stukken ook afgewezen. Interstatelijke vertrouwelijkheid.	
1	https://uitspraken.rechtspraak.nl/inziendocument?id=ECLI:NL:RBDHA:2022:11457&showbutton=true	09-11-2022	09-11-2022	Civiel recht	Bodemzaak, Eerste aanleg - meervoudig	Rechtspraak.nl	Beroep op volledige nadeelscompensatie (voor onevenredige schade door coronamaatregelen) horecaondermemers op grond van het égalitébeginsel slaagt niet.	
2	https://uitspraken.rechtspraak.nl/inziendocument?id=ECLI:NL:RBDHA:2022:11389&showbutton=true	09-11-2022	09-11-2022	Civiel recht	Bodemzaak, Eerste aanleg - meervoudig	Rechtspraak.nl	"Geschil over het uit de VVD-fractie zetten van een Eerste Kamerlid. De beslissing een lid uit een fractie van een partij te zetten betreft politieke besluitvorming en speelt zich af in een autonome politieke sfeer, waarbij voor rechterlijk ingrijpen ...  
                 meer"	
3	https://uitspraken.rechtspraak.nl/inziendocument?id=ECLI:NL:RBDHA:2022:11601&showbutton=true	07-11-2022	08-11-2022	Personen- en familierecht	Beschikking	Rechtspraak.nl	Vaststellen van een verlengde onderhoudsplicht bij een dochter van 22 jaar oud. De rechtbank oordeelt dat er sprake is van een natuurlijke verbintenis op grond waarvan de vader ook ná het 21e levensjaar van de minderjarige kinderalimentatie moet betalen.	
4	https://uitspraken.rechtspraak.nl/inziendocument?id=ECLI:NL:RBROT:2022:9375&showbutton=true	04-11-2022	04-11-2022	Civiel recht	Kort geding	Rechtspraak.nl	"Kort geding; vordering tegen bestuurdersaansprakelijkheidsverzekeraar tot vergoeding van (niet gespecificeerde) kosten van verweer. Dat verweer betreft een hoger beroep tegen een beschikking waarin eisers zijn ontslagen als bestuurders van een sticht...  
                 meer"	
5	https://uitspraken.rechtspraak.nl/inziendocument?id=ECLI:NL:RBMNE:2022:4364&showbutton=true	04-11-2022	04-11-2022	Civiel recht	Kort geding	Rechtspraak.nl	"Deze zaak gaat over overlast. Woonpalet heeft in de loop van 2021 veel overlastmeldingen over de huurders van de (directe) buren ontvangen. Ondanks de inzet van Woonpalet, politie, gemeente en de betrokken hulpverlenende instanties wordt de door huur...  
                 meer"	
6	https://uitspraken.rechtspraak.nl/inziendocument?id=ECLI:NL:RBROT:2022:9447&showbutton=true	04-11-2022	07-11-2022	Verbintenissenrecht	Proces-verbaal	Rechtspraak.nl	NVM-koopakte. Eén van de kopers beroept zich op (onder andere) ontbreken van wil, dwaling en ontbinding binnen de 7:2-BW-termijn. Alle verweren verworpen. Boete gematigd.	
7	https://uitspraken.rechtspraak.nl/inziendocument?id=ECLI:NL:RBROT:2022:9348&showbutton=true	04-11-2022	07-11-2022	Verbintenissenrecht	Eerste aanleg - enkelvoudig	Rechtspraak.nl	Gemengde overeenkomst van aanneming en koop. Gordijnen beantwoorden niet aan de overeenkomst. Rechtsgeldige buitengerechtelijke ontbinding. Artikel 6:272 BW	
8	https://uitspraken.rechtspraak.nl/inziendocument?id=ECLI:NL:RBROT:2022:9374&showbutton=true	04-11-2022	07-11-2022	Verbintenissenrecht	Eerste aanleg - enkelvoudig	Rechtspraak.nl	Bewoning trainingswoning als gevolg van justitiële maatregel zonder schriftelijke huurovereenkomst; voldaan aan de vereisten van een huurovereenkomst	
9	https://uitspraken.rechtspraak.nl/inziendocument?id=ECLI:NL:RBROT:2022:9426&showbutton=true	04-11-2022	07-11-2022	Civiel recht	Kort geding	Rechtspraak.nl	Kort geding. De dagvaarding is betekend aan het postadres van gedaagde dat volgt uit de BRP. Verstek verleend. Gedaagde wordt veroordeeld tot het geven van een verklaring wat er met de door hem in ontvangst genomen zending is gebeurd. Dwangsom.	
10	https://uitspraken.rechtspraak.nl/inziendocument?id=ECLI:NL:RBZWB:2022:6466&showbutton=true	04-11-2022	08-11-2022	Civiel recht	Bodemzaak	Rechtspraak.nl	Vordering van gemeente tot ontruiming toegewezen; spoedeisend belang; beslissing dat huurovereenkomst rechtsgeldig door opzegging is geëindigd heeft gezag van gewijsde; stichting maakt zonder recht of titel gebruik van gehuurde; geen misbruik van recht.	
11	https://uitspraken.rechtspraak.nl/inziendocument?id=ECLI:NL:RBROT:2022:9488&showbutton=true	04-11-2022	08-11-2022	Civiel recht	Eerste aanleg - enkelvoudig	Rechtspraak.nl	Geldvordering.	
12	https://uitspraken.rechtspraak.nl/inziendocument?id=ECLI:NL:RBROT:2022:9489&showbutton=true	04-11-2022	08-11-2022	Civiel recht	Eerste aanleg - enkelvoudig	Rechtspraak.nl	Geldvordering.	
13	https://uitspraken.rechtspraak.nl/inziendocument?id=ECLI:NL:RBROT:2022:9490&showbutton=true	04-11-2022	08-11-2022	Civiel recht	Eerste aanleg - enkelvoudig	Rechtspraak.nl	Geldvordering.	
14	https://uitspraken.rechtspraak.nl/inziendocument?id=ECLI:NL:RBROT:2022:9520&showbutton=true	04-11-2022	08-11-2022	Civiel recht	Eerste aanleg - enkelvoudig	Rechtspraak.nl	Kantonrechter komt terug op de verleende afstand van instantie. Na vermindering van eis resteert alleen nog een proceskostenveroordeling. Geen aanleiding om het voorstel van gedaagden te volgen om prejudiciële vragen aan de Hoge Raad voor te leggen over artikel 7:417 lid 2 en 3 BW.	
15	https://uitspraken.rechtspraak.nl/inziendocument?id=ECLI:NL:RBROT:2022:9454&showbutton=true	04-11-2022	08-11-2022	Civiel recht	Eerste aanleg - enkelvoudig	Rechtspraak.nl	Opheffing beslag gevorderd in art. 223 Rv-incident. Levert 403-verklaring van buitenlandse vennootschap voldoende vervangende zekerheid op? Afwijzing.	
16	https://uitspraken.rechtspraak.nl/inziendocument?id=ECLI:NL:RBNHO:2022:9784&showbutton=true	04-11-2022	09-11-2022	Personen- en familierecht	Eerste aanleg - enkelvoudig	Rechtspraak.nl	"Ontkenning vaderschap + gelijktijdige (voorwaardelijke) beslissing over gerechtelijke vaststelling ouderschap. Geslachtsnaam. IPR. Deze beslissing wijkt af van de richtlijn van de Expertgroep Adoptie en Overige Boek 1 zaken dat niet in één beschikkin...  
                 meer"	
17	https://uitspraken.rechtspraak.nl/inziendocument?id=ECLI:NL:RBDHA:2022:11398&showbutton=true	03-11-2022	04-11-2022	Insolventierecht	Eerste aanleg - enkelvoudig	Rechtspraak.nl	Afwijzing verzoek WSNP. Schulden niet te goeder trouw. Niet de verwachting dat verplichtingen uit regeling zullen worden nagekomen.	
18	https://uitspraken.rechtspraak.nl/inziendocument?id=ECLI:NL:RBOBR:2022:4822&showbutton=true	03-11-2022	04-11-2022	Civiel recht	Bodemzaak, Eerste aanleg - enkelvoudig	Rechtspraak.nl	"De vraag die in deze zaak centraal staat is of het ziekenhuis een patiënt voor een behandeling had moeten waarschuwen dat haar verzekering de kosten van de behandeling niet geheel dekte. Eiseres (het ziekenhuis) vindt dat de dekking van de zorgverzek...  
                 meer"	
19	https://uitspraken.rechtspraak.nl/inziendocument?id=ECLI:NL:RBOBR:2022:4823&showbutton=true	03-11-2022	09-11-2022	Civiel recht	Kort geding	Rechtspraak.nl	vordering tot heraansluiting  na afsluiting elektriciteit ivm diefstal stroom ihkv opgerolde hennepkwekerij	
20	https://uitspraken.rechtspraak.nl/inziendocument?id=ECLI:NL:RBZWB:2022:6569&showbutton=true	03-11-2022	09-11-2022	Civiel recht	Bodemzaak	Rechtspraak.nl	Eindbeschikking na bewijslevering t.a.v. de loonvordering en ongerechtvaardigde verrijking.	
21	https://uitspraken.rechtspraak.nl/inziendocument?id=ECLI:NL:RBMNE:2022:4291&showbutton=true	02-11-2022	02-11-2022	Civiel recht	Eerste aanleg - meervoudig	Rechtspraak.nl	"Afwijzing vordering van zorgkantoor Zilveren Kruis op zorgverlener Fundament tot terugbetaling van niet-verantwoorde pgb-gelden. De budgethouders hebben zelf geen schade geleden omdat zij de vordering die Zilveren Kruis op hen heeft, niet hoeven teru...  
                 meer"	
22	https://uitspraken.rechtspraak.nl/inziendocument?id=ECLI:NL:RBOVE:2022:3176&showbutton=true	02-11-2022	02-11-2022	Civiel recht	Kort geding	Rechtspraak.nl	Ontruiming aanleunwoning in kort geding toegewezen vanwege strafbaar en volstrekt ontoelaatbaar gedrag huurder. Opleggen locatie- en gebiedsverbod eveneens gerechtvaardigd.	
23	https://uitspraken.rechtspraak.nl/inziendocument?id=ECLI:NL:RBROT:2022:8829&showbutton=true	02-11-2022	03-11-2022	Verbintenissenrecht	Eerste aanleg - enkelvoudig	Rechtspraak.nl	Artikel 6:225 lid 3 BW vereist dat naast een verwijzing naar de eigen voorwaarden tevens en uitdrukkelijk de toepasselijkheid van de algemene voorwaarden van de ander van de hand wordt gewezen.	
24	https://uitspraken.rechtspraak.nl/inziendocument?id=ECLI:NL:RBDHA:2022:10911&showbutton=true	02-11-2022	03-11-2022	Civiel recht	Eerste aanleg - enkelvoudig	Rechtspraak.nl	Begaclaim. Vraag of Staat aansprakelijk is o.g.v. onrechtmatige daad (6:162 BW), doordat eiser gedetineerd heeft gezeten in een strafzaak waarin hij is vrijgesproken. Sprake van onrechtmatig rechtspraak? Vorderingen afgewezen.	
25	https://uitspraken.rechtspraak.nl/inziendocument?id=ECLI:NL:RBAMS:2022:6242&showbutton=true	02-11-2022	04-11-2022	Civiel recht	Eerste aanleg - enkelvoudig	Rechtspraak.nl	Blokker B.V. moet bijna 125.000 euro schadevergoeding betalen aan de voormalig exploitant van een Blokkerfiliaal. Dat heeft de rechtbank geoordeeld.	
26	https://uitspraken.rechtspraak.nl/inziendocument?id=ECLI:NL:RBAMS:2022:6310&showbutton=true	02-11-2022	04-11-2022	Civiel recht	Kort geding	Rechtspraak.nl	De voorzieningenrechter heeft een verzoek van een Russische schuldeiser om aandelen over te dragen voor 1 euro, afgewezen.	
27	https://uitspraken.rechtspraak.nl/inziendocument?id=ECLI:NL:RBROT:2022:9423&showbutton=true	02-11-2022	07-11-2022	Civiel recht	Kort geding	Rechtspraak.nl	Kort geding. Contactverbod in conventie en reconventie gevorderd. Vorderingen over en weer afgewezen. De buurtgenoten moeten in staat zijn om elkaar, zoals in de mediation afgesproken, te negeren en uit te gaan van leven en laten leven.	
28	https://uitspraken.rechtspraak.nl/inziendocument?id=ECLI:NL:RBZWB:2022:6493&showbutton=true	02-11-2022	07-11-2022	Personen- en familierecht	Eerste aanleg - enkelvoudig, Beschikking	Rechtspraak.nl	"Verzoek wijziging partneralimentatie. Wijziging van omstandigheden omdat vrouw geen informatie heeft verstrekt over haar inspanningsverplichting. 
Onvoldoende onderbouwing dat gezondheidsklachten haar beperken. Fictief inkomen leidt tot een verlaging van de partneralimentatie."	
29	https://uitspraken.rechtspraak.nl/inziendocument?id=ECLI:NL:RBAMS:2022:5778&showbutton=true	02-11-2022	07-11-2022	Personen- en familierecht	Eerste aanleg - enkelvoudig	Rechtspraak.nl	Verzekerinsrecht, erfrecht, huwelijksgoederenrecht. Ex-echtgenoot was gerechtigd overlijdensrisicoverzekering te veranderen ORV is geen boedelbestanddeel van de huwelijksgemeenschap.	
30	https://uitspraken.rechtspraak.nl/inziendocument?id=ECLI:NL:RBNHO:2022:9454&showbutton=true	02-11-2022	07-11-2022	Civiel recht	Bodemzaak	Rechtspraak.nl	Oud-fractievoorzitter Forza! in de gemeenteraad Haarlemmermeer heeft rekening-courant verhouding onderhouden met de bankrekening. Hij wordt verantwoordelijk gehouden voor het kastekort en moet de door de gemeente  teruggevorderde fractievergoeding voldoen	
31	https://uitspraken.rechtspraak.nl/inziendocument?id=ECLI:NL:RBNHO:2022:9434&showbutton=true	02-11-2022	07-11-2022	Verbintenissenrecht	Bodemzaak	Rechtspraak.nl	Vervroegde aankomst, Montreal toch van toepassing want niet gebleken dat de passagiers na annulering alsnog zonder vertraging op de eindbestemming hadden kunnen aankomen. Vervoerder heeft niet de mogelijkheid gehad een alternatieve vlucht te regelen.	
32	https://uitspraken.rechtspraak.nl/inziendocument?id=ECLI:NL:RBNNE:2022:4086&showbutton=true	02-11-2022	08-11-2022	Personen- en familierecht	Eerste aanleg - enkelvoudig, Op tegenspraak	Rechtspraak.nl	1:253ha BW. Meerderjarig verklaring. Gezag van rechtswege na meerderjarig verklaring.	
33	https://uitspraken.rechtspraak.nl/inziendocument?id=ECLI:NL:RBGEL:2022:5924&showbutton=true	02-11-2022	09-11-2022	Verbintenissenrecht	Eerste aanleg - enkelvoudig, Op tegenspraak, Tussenuitspraak	Rechtspraak.nl	Geschil onderaannemer - hoofdaannemer. Omvang opdracht. Meerwerk en nakoming waarschuwingsverplichting (7:755 BW). Bewijsopdracht aan onderaannemer.	
34	https://uitspraken.rechtspraak.nl/inziendocument?id=ECLI:NL:RBGEL:2022:6231&showbutton=true	02-11-2022	09-11-2022	Verbintenissenrecht	Eerste aanleg - enkelvoudig	Rechtspraak.nl	Afnemer is boete verschuldigd vanwege tussentijds annuleren overeenkomst voor leveren en installeren zonnepanelen. Geen sprake van opzegging door leverancier of beëindiging met wederzijds goedvinden. Uitleg boetebepaling AV. Matiging boete.	
35	https://uitspraken.rechtspraak.nl/inziendocument?id=ECLI:NL:RBGEL:2022:6160&showbutton=true	02-11-2022	09-11-2022	Intellectueel-eigendomsrecht	Eerste aanleg - enkelvoudig	Rechtspraak.nl	Auteursrecht op flessenwarmers. Uit vormgevingserfgoed blijkt de keuzevrijheid van de maker. Ontwerpkeuzes niet technisch bepaald, triviaal of banaal. Verbod voor de gehele Europese Unie.	
36	https://uitspraken.rechtspraak.nl/inziendocument?id=ECLI:NL:RBGEL:2022:6187&showbutton=true	02-11-2022	09-11-2022	Civiel recht	Eerste aanleg - enkelvoudig	Rechtspraak.nl	Vervoersrecht. Afzender vordert schadevergoeding van vervoerder wegens ladingdiefstal. Rechter wijst vorderingen toe tot CMR-limiet. Geen opzet. Geen overmacht. Geen schending verzwaarde motiveringsplicht.	
37	https://uitspraken.rechtspraak.nl/inziendocument?id=ECLI:NL:RBGEL:2022:6110&showbutton=true	02-11-2022	09-11-2022	Verbintenissenrecht	Eerste aanleg - enkelvoudig	Rechtspraak.nl	Vordering verklaring voor recht dat besluit van VvE nietig is wegens strijd met art.5:127 lid 3 jo 5:129 lid 1 jo 2:14 BW.	
38	https://uitspraken.rechtspraak.nl/inziendocument?id=ECLI:NL:RBGEL:2022:6234&showbutton=true	02-11-2022	09-11-2022	Civiel recht	Eerste aanleg - enkelvoudig	Rechtspraak.nl	Vervolg op ECLI:NL:RBGEL:2022:2322. Tussenvonnis na (tegen)bewijsopdracht. Partijen moeten zich nader uitlaten over afrekening over bepaalde zaken in de geërfde woning en de gevolgen daarvan voor de afrekening cfm de meerwaardeclausule uit 1920 en 1961.	
39	https://uitspraken.rechtspraak.nl/inziendocument?id=ECLI:NL:RBZWB:2022:6568&showbutton=true	02-11-2022	09-11-2022	Civiel recht	Bodemzaak	Rechtspraak.nl	Art 15 WAM. Geen schending van art 7:928 BW mededelingsplicht. Ingangsdatum van de verzekeringspolis is de datum van de aanrijding, zodat de verplichte mededelingsplicht is geëindigd voordat de schade werd gereden. Sprake van een verzekering met dekking.	
40	https://uitspraken.rechtspraak.nl/inziendocument?id=ECLI:NL:RBNHO:2022:9716&showbutton=true	02-11-2022	09-11-2022	Personen- en familierecht	Eerste aanleg - enkelvoudig	Rechtspraak.nl	"Beëindiging gezamenlijk gezag is in het belang van de minderjarigen noodzakelijk. De vader is geëmigreerd naar Curaçao en heeft daardoor letterlijk en figuurlijk een ouderrol op afstand en is weinig betrokken bij gezagsbeslissingen.
De ouders hebben ...  
                 meer"	
41	https://uitspraken.rechtspraak.nl/inziendocument?id=ECLI:NL:RBGEL:2022:6167&showbutton=true	02-11-2022	09-11-2022	Burgerlijk procesrecht	Eerste aanleg - enkelvoudig	Rechtspraak.nl	Burgerlijk Procesrecht. Bevoegdheidsincident. Verwijzing op grond van het Zaaksverdelingsreglement in combinatie met het Besluit interne relatieve bevoegdheid.	
42	https://uitspraken.rechtspraak.nl/inziendocument?id=ECLI:NL:RBNHO:2022:9902&showbutton=true	02-11-2022	09-11-2022	Personen- en familierecht	Eerste aanleg - enkelvoudig	Rechtspraak.nl	"De minderjarigen worden toevertrouwd aan de vrouw en krijgen een zorgregeling met de man in kader van voorlopige voorzieningen. Het verzoek van de man om een birdnestingsregeling te bepalen wordt afgewezen. De communicatie tussen partijen is verstoor...  
                 meer"	
43	https://uitspraken.rechtspraak.nl/inziendocument?id=ECLI:NL:RBROT:2022:9363&showbutton=true	02-11-2022	09-11-2022	Burgerlijk procesrecht	Eerste aanleg - enkelvoudig	Rechtspraak.nl	Tussenvonnis. Vervolg op vonnis in het incident van 17 augustus 2022 (C/10/637654/HA ZA 22-373). Genoegzaam zekerheid gesteld voor proceskosten? Storting op derdengeldrekening eigen advocaat met borgstelling.	
44	https://uitspraken.rechtspraak.nl/inziendocument?id=ECLI:NL:RBROT:2022:9231&showbutton=true	01-11-2022	01-11-2022	Personen- en familierecht	Beschikking	Rechtspraak.nl	Voogdij opgedragen aan gecertificeerde instelling. Neutraliteit en deskundigheid zijn nodig, mede vanwege de spanningen in de familie. De minderjarigen hebben er belang bij dat de hele familie er in de toekomst voor hen is, ook als er onenigheid is over wie het beste voor hen kan zorgen.	
45	https://uitspraken.rechtspraak.nl/inziendocument?id=ECLI:NL:RBMNE:2022:4330&showbutton=true	01-11-2022	01-11-2022	Civiel recht	Kort geding	Rechtspraak.nl	Geen duurzame gemeenschappelijke huishouding in de zin van artikel 7:268 lid 2 BW, zodat de zoon van de overleden huurders de woning dient te ontruimen. De voorts gevorderde huurachterstand wordt op grond van artikel 7:268 lid 5 BW toegewezen.	
46	https://uitspraken.rechtspraak.nl/inziendocument?id=ECLI:NL:RBDHA:2022:11348&showbutton=true	01-11-2022	02-11-2022	Civiel recht	Kort geding	Rechtspraak.nl	Kort geding. Europese niet-openbare aanbesteding. De voorzieningenrechter gebiedt de aanbestedende dienst om haar oordeel dat de inschrijving van Vermeulen geldig is, alsnog deugdelijk te motiveren.	
47	https://uitspraken.rechtspraak.nl/inziendocument?id=ECLI:NL:RBOVE:2022:3187&showbutton=true	01-11-2022	03-11-2022	Civiel recht	Kort geding	Rechtspraak.nl	Het gaat in deze zaak om de levering van 77 iPads. Gedaagde stelt dat deze iPads door problemen bij de verzending niet bij eiseres zijn geleverd. In kort geding vordert eiseres levering van deze iPads. De vordering wordt door gedaagde niet betwist en zal worden toegewezen.	
48	https://uitspraken.rechtspraak.nl/inziendocument?id=ECLI:NL:RBGEL:2022:6145&showbutton=true	01-11-2022	08-11-2022	Verbintenissenrecht	Beschikking	Rechtspraak.nl	Art.35 UAVG-verzoek van UBO van twee stichtingen, verzoek om inzage en informatie ex art. 15 en 22 AVG (geautomatiseerde besluitvorming en profilering), verweerder is betaaldienstverlener die de dienstverlening aan twee stichtingen heeft opgezegd.	
49	https://uitspraken.rechtspraak.nl/inziendocument?id=ECLI:NL:RBOVE:2022:3243&showbutton=true	01-11-2022	08-11-2022	Civiel recht	Eerste aanleg - enkelvoudig	Rechtspraak.nl	"Eiser heeft werkzaamheden uitgevoerd voor gedaagde en heeft daarvoor een factuur naar gedaagde verstuurd. Gedaagde wil deze factuur niet betalen omdat eiser niet transparant geweest is over de kosten die hij in rekening brengt. De kantonrechter oorde...  
                 meer"	
50	https://uitspraken.rechtspraak.nl/inziendocument?id=ECLI:NL:RBGEL:2022:6165&showbutton=true	01-11-2022	08-11-2022	Civiel recht	Kort geding	Rechtspraak.nl	"Kort geding. Derde juridische procedure tussen kinderen over het (niet) verkopen van de woning van moeder, die elders wordt verzorgd. Eiseres in conventie is niet vertegenwoordigingsbevoegd ten aanzien van de woning en is in haar vorderingen niet-ont...  
                 meer"	
51	https://uitspraken.rechtspraak.nl/inziendocument?id=ECLI:NL:RBGEL:2022:6184&showbutton=true	01-11-2022	08-11-2022	Civiel recht	Kort geding	Rechtspraak.nl	Kort geding. Onderhandse uitgifte grond in erfpacht. Uitgifteprocedure tussentijds gestaakt vanwege het Didam-arrest. Gedaagde mocht voorbereidende contractsbesprekingen over gronduitgifte staken. Geen schending vertrouwensbeginsel. Vordering afgewezen.	
52	https://uitspraken.rechtspraak.nl/inziendocument?id=ECLI:NL:RBZWB:2022:6620&showbutton=true	01-11-2022	09-11-2022	Personen- en familierecht	Rekestprocedure	Rechtspraak.nl	Vaststelling hoofdverblijfplaats en wijziging zorgregeling in verhouding tot schorsingsvoorwaarden voorlopige hechtenis minderjarige. Afwijzing onderzoek raad voor de kinderbescherming. Verwijzing geldvordering naar kantonrechter	
53	https://uitspraken.rechtspraak.nl/inziendocument?id=ECLI:NL:RBOVE:2022:3270&showbutton=true	01-11-2022	09-11-2022	Civiel recht	Eerste aanleg - enkelvoudig, Beschikking	Rechtspraak.nl	"Betreft een verzoek om ontruimingsbescherming ex artikel 7:230a BW. De kantonrechter wijst de vordering deels toe, en verlengt de ontruimingstermijn met enkele maanden. Verhuurder heeft zelf al enig uitstel toegestaan en de belangen van de huurder om...  
                 meer"	
54	https://uitspraken.rechtspraak.nl/inziendocument?id=ECLI:NL:RBNNE:2022:4101&showbutton=true	01-11-2022	09-11-2022	Civiel recht	Bodemzaak, Eerste en enige aanleg, Proceskostenveroordeling, Schadevergoedingsuitspraak, Op tegenspraak	Rechtspraak.nl	Wateroverlast na hevige regenval. Lekkage in kelder. Eiser stelt gedaagde, een verderop wonende buurman, aansprakelijk voor de schade op grond van onrechtmatige daad. Gedaagde heeft ontheffing van het waterschap om perceel te bemalen, maar heeft de bemalingsinstallatie tijdelijk buiten bedrijf gesteld in verband met verbouwingswerkzaamheden	
55	https://uitspraken.rechtspraak.nl/inziendocument?id=ECLI:NL:RBROT:2022:9185&showbutton=true	31-10-2022	31-10-2022	Civiel recht	Eerste aanleg - enkelvoudig	Rechtspraak.nl	Onderaanneming. Onderaannemer vordert betaling van facturen door aannemer. Aannemer stelt schade te hebben geleden door werkzaamheden van onderaannemer en doet een beroep op verrekening. Beroep op verrekening slaagt niet.	
56	https://uitspraken.rechtspraak.nl/inziendocument?id=ECLI:NL:RBOVE:2022:3157&showbutton=true	31-10-2022	01-11-2022	Civiel recht	Wraking	Rechtspraak.nl	"De wrakingskamer overweegt dat wraking een verzoek is om een voor de behandeling van de zaak aangewezen rechter doen vervangen door een andere rechter. Een verzoek tot wraking kan in beginsel in elke stand van de procedure worden gedaan, mits de beha...  
                 meer"	
57	https://uitspraken.rechtspraak.nl/inziendocument?id=ECLI:NL:RBOVE:2022:3156&showbutton=true	31-10-2022	01-11-2022	Civiel recht	Eerste aanleg - enkelvoudig	Rechtspraak.nl	"Partijen huren beiden een etage van hetzelfde gebouw en huren beiden (volledig) het bij het gebouw behorende terrein. Gedaagde heeft twee camera’s in gebruik die gericht zijn op het terrein. Eiser stelt dat hij zijn woning niet in of uit kan zonder i...  
                 meer"	
58	https://uitspraken.rechtspraak.nl/inziendocument?id=ECLI:NL:RBDHA:2022:11290&showbutton=true	31-10-2022	04-11-2022	Insolventierecht	Eerste aanleg - enkelvoudig	Rechtspraak.nl	Toewijzing verzoek dwangakkoord. Maximaal haalbare. Weigering i.v.m. alimentatie en ernstig verstoorde relatie. Niet-zakelijke redenen.	
59	https://uitspraken.rechtspraak.nl/inziendocument?id=ECLI:NL:RBDHA:2022:11291&showbutton=true	31-10-2022	04-11-2022	Insolventierecht	Eerste aanleg - enkelvoudig	Rechtspraak.nl	Toewijzing verzoek dwangakkoord. Maximaal haalbare. Aard vordering (goede trouw) niet doorslaggevend.	
60	https://uitspraken.rechtspraak.nl/inziendocument?id=ECLI:NL:RBDHA:2022:11289&showbutton=true	31-10-2022	04-11-2022	Insolventierecht	Eerste aanleg - enkelvoudig	Rechtspraak.nl	"Verzoek dwangakkoord. De advocaat kan voor de beloning voor zijn werkzaamheden tijdens de uitvoering van het minnelijk traject aansluiting zoeken bij het “Besluit Vergoeding Bewindvoerder Schuldsanering 2013”. De wetgever heeft geen beloning voor sch...  
                 meer"	
61	https://uitspraken.rechtspraak.nl/inziendocument?id=ECLI:NL:RBDHA:2022:11292&showbutton=true	31-10-2022	04-11-2022	Insolventierecht	Eerste aanleg - enkelvoudig	Rechtspraak.nl	Toewijzing verzoek dwangakkoord. Maximaal haalbare. Partner in Wsnp. Aard vordering (goed trouw) niet van doorslaggevende betekenis.	
62	https://uitspraken.rechtspraak.nl/inziendocument?id=ECLI:NL:RBAMS:2022:6240&showbutton=true	31-10-2022	04-11-2022	Civiel recht	Eerste aanleg - enkelvoudig	Rechtspraak.nl	Een man hoeft sportschool Basic Fit geen abonnementsgeld te betalen vanwege een oneerlijk beding in de algemene voorwaarden. Dat heeft de kantonrechter bepaald.	
63	https://uitspraken.rechtspraak.nl/inziendocument?id=ECLI:NL:RBLIM:2022:8618&showbutton=true	31-10-2022	07-11-2022	Personen- en familierecht	Beschikking	Rechtspraak.nl	Verzoek vervangende toestemming erkenning. IPR: Artikel 10: 95 BW. Nederlands recht van toepassing nu Marokkaans recht erkenning (buiten huwelijk) niet kent. Verzoek na belangenafweging afgewezen. Verzoek omgang. IPR: Artikel 17 HKV. Nederlands recht toegepast. Family life vastgesteld. Raadsonderzoek gevraagd.	
64	https://uitspraken.rechtspraak.nl/inziendocument?id=ECLI:NL:RBOVE:2022:3241&showbutton=true	31-10-2022	08-11-2022	Civiel recht	Kort geding	Rechtspraak.nl	Eiser vordert voortzetting van de ADL-overeenkomst	
65	https://uitspraken.rechtspraak.nl/inziendocument?id=ECLI:NL:RBROT:2022:9494&showbutton=true	31-10-2022	08-11-2022	Personen- en familierecht	Beschikking	Rechtspraak.nl	beschikking verlenging ondertoezichtstelling en geschillenbeslechting	
66	https://uitspraken.rechtspraak.nl/inziendocument?id=ECLI:NL:RBOVE:2022:3244&showbutton=true	31-10-2022	09-11-2022	Insolventierecht	Eerste aanleg - enkelvoudig	Rechtspraak.nl	Toewijzing verzoek dwangakkoord. Voorstel goed en betrouwbaar gedocumenteerd. ING Bank N.V., enige weigeraar, lijkt onterecht onderscheid te maken in NVVK-leden en niet-NVVK-leden wat betreft aan te leveren documenten voor beoordeling aanbod aan schuldeisers. Onder andere daardoor in redelijkheid niet tot weigering kunnen komen.	
