	index	Datum uitspraak:	Datum publicatie:	Rechtsgebieden:	Bijzondere kenmerken:	Vindplaatsen:	Inhoudsindicatie:	Formele relaties:
139	https://uitspraken.rechtspraak.nl/inziendocument?id=ECLI:NL:RBMNE:2022:4293&showbutton=true	25-10-2022	31-10-2022	Civiel recht	Wraking	Rechtspraak.nl	Wrakingszaak. Niet beslissen voorafgaand of aan het begin van de zitting over het al dan niet nemen van een akte is een procesbeslissing. Hieruit blijkt niet van vooringenomenheid. Het opmaken van een proces-verbaal buiten partijen is geen grond voor wraking. Wrakingsverzoek ongegrond.	
140	https://uitspraken.rechtspraak.nl/inziendocument?id=ECLI:NL:RBMNE:2022:4292&showbutton=true	25-10-2022	31-10-2022	Civiel recht	Wraking	Rechtspraak.nl	Wrakingszaak. Wrakingsgrond dat de rechter niet naar verzoeker wilde luisteren en verzoeker daarom niet zo wordt behandeld als andere Nederlanders slaagt niet. dit blijkt niet uit het proces-verbaal van zitting. Wrakingsverzoek ongegrond.	
141	https://uitspraken.rechtspraak.nl/inziendocument?id=ECLI:NL:RBOVE:2022:3149&showbutton=true	25-10-2022	31-10-2022	Civiel recht	Eerste aanleg - enkelvoudig, Tussenuitspraak	Rechtspraak.nl	Gevorderde ontruiming wegens huurachterstand. Gedaagde wordt in de gelegenheid gesteld om te bewijzen dat hij de huur heeft voldaan.	
142	https://uitspraken.rechtspraak.nl/inziendocument?id=ECLI:NL:RBLIM:2022:8265&showbutton=true	25-10-2022	01-11-2022	Arbeidsrecht	Eerste aanleg - enkelvoudig	Rechtspraak.nl	"Ontslag tijdens proeftijd. 
Verzoekster wordt nog voordat ze in dienst getreden is bij werkgever ontslagen. 
Verzoekster is gediagnostiseerd met een agressieve vorm van longkanker en zij meldt dit bij haar nieuwe werkgever. 
Verzoekster vecht het pro...  
                 meer"	
143	https://uitspraken.rechtspraak.nl/inziendocument?id=ECLI:NL:RBAMS:2022:5906&showbutton=true	25-10-2022	06-11-2022	Civiel recht	Eerste aanleg - enkelvoudig	Rechtspraak.nl	Huurders hebben onjuiste inlichtingen aan verhuurster verstrekt. Verklaring voor recht dat de huurovereenkomst op grond van dwaling buitengerechtelijk is vernietigd.	
144	https://uitspraken.rechtspraak.nl/inziendocument?id=ECLI:NL:RBOVE:2022:3173&showbutton=true	25-10-2022	02-11-2022	Civiel recht	Eerste aanleg - enkelvoudig	Rechtspraak.nl	Eindvonnis in vrijwaringszaak. Eiseres in vrijwaring heeft onvoldoende onderbouwd dat zij gedaagde in vrijwaring kent en dat hij verantwoordelijk is voor de Whatsappfraude waarvoor zij in de hoofdzaak is veroordeeld.	Tussenuitspraak: ECLI:NL:RBOVE:2022:1680
145	https://uitspraken.rechtspraak.nl/inziendocument?id=ECLI:NL:RBDHA:2022:11344&showbutton=true	25-10-2022	09-11-2022	Civiel recht	Beschikking	Rechtspraak.nl	Verzoek van het Openbaar Ministerie strekkende tot ontslag van bestuurders van een stichting toegewezen.	
146	https://uitspraken.rechtspraak.nl/inziendocument?id=ECLI:NL:RBDHA:2022:11174&showbutton=true	25-10-2022	09-11-2022	Civiel recht	Kort geding	Rechtspraak.nl	Kort geding. Mondeling vonnis 30p Rv. Geldvordering in conventie en opheffing beslag in reconventie worden afgewezen. Geldvordering is onvoldoende aannemelijk en reconventionele vordering is niet onderbouwd.	
147	https://uitspraken.rechtspraak.nl/inziendocument?id=ECLI:NL:RBOVE:2022:3108&showbutton=true	24-10-2022	26-10-2022	Arbeidsrecht	Kort geding	"AR-Updates.nl 2022-1177 
            
            Rechtspraak.nl"	"Concurrentiebeding. De voorzieningenrechter is van oordeel dat eiseres onvoldoende onderbouwd heeft gesteld dat haar bedrijfsdebiet substantieel en stelselmatig wordt afgebroken. In tegendeel, eiseres erkent dat van afbreuk op dit moment nog geen spr...  
                 meer"	
148	https://uitspraken.rechtspraak.nl/inziendocument?id=ECLI:NL:RBAMS:2022:6191&showbutton=true	24-10-2022	28-10-2022	Civiel recht	Eerste aanleg - enkelvoudig	"AR-Updates.nl 2022-1187 
            
            Rechtspraak.nl"	Ontbinding van de arbeidsovereenkomst is toegewezen	
149	https://uitspraken.rechtspraak.nl/inziendocument?id=ECLI:NL:RBNNE:2022:3924&showbutton=true	24-10-2022	28-10-2022	Civiel recht	Op tegenspraak, Beschikking	"AR-Updates.nl 2022-1201 
            
            Rechtspraak.nl"	Ontbinding van de arbeidsovereenkomst wegens verwijtbaar handelen werknemer; signaal discriminatie, niet meewerken aan intern onderzoek, wijze van benaderen collega’s veroorzaakt onrust binnen werkgever	
150	https://uitspraken.rechtspraak.nl/inziendocument?id=ECLI:NL:RBROT:2022:9029&showbutton=true	24-10-2022	01-11-2022	Aanbestedingsrecht	Kort geding	Rechtspraak.nl	KG. Gedaagde is overheidslichaam. Mag gedaagde onroerend goed verkopen aan derde zonder openbare selectieprocedure? Toepassing Didam-arrest. Antwoord: Nee. Beroep van gedaagde op uitzondering van dat arrest faalt. Selectieprocedure is vereist.	
151	https://uitspraken.rechtspraak.nl/inziendocument?id=ECLI:NL:RBROT:2022:9035&showbutton=true	24-10-2022	07-11-2022	Verbintenissenrecht	Kort geding	Rechtspraak.nl	KG. Geschil over welke arbeidsovk tussen partijen geldt en of gedaagde na einde ovk inbreuk maakt op bedingen mbt geheimhouding, documenten en non-concurrentie. Gevorderde inzage na bewijsbeslag en kosten afgewezen, onvoldoende bepaalbaar en dubbel.	
152	https://uitspraken.rechtspraak.nl/inziendocument?id=ECLI:NL:RBROT:2022:9414&showbutton=true	24-10-2022	07-11-2022	Arbeidsrecht	Kort geding	Rechtspraak.nl	Kort geding. Niet gevaccineerde werknemer vordrt tewerkstelling in het buitenland. Om diverse redenen geen concrete mogelijkheden voorhanden, dus geen spoed. Hoogte salaris zal bewezen moeten worden. Daar leent kort geding zich niet voor. Afwijzing.	
153	https://uitspraken.rechtspraak.nl/inziendocument?id=ECLI:NL:RBROT:2022:9453&showbutton=true	24-10-2022	07-11-2022	Civiel recht	Beschikking	Rechtspraak.nl	Oosv houdt geen stand; ‘druppel’ is niet komen vast te staan; in rechte wordt er niet van uitgegaan dat nevenwerkzaamhedenverbod is overtreden; wn is arbeidsongeschikt; voorwaardelijk ontbindingsverzoek niet toewijsbaar vanwege opzegverbod tijdens ziekte.	
154	https://uitspraken.rechtspraak.nl/inziendocument?id=ECLI:NL:RBMNE:2022:4448&showbutton=true	24-10-2022	09-11-2022	Personen- en familierecht	Beschikking	Rechtspraak.nl	Niet-ontvankelijkverklaring van verzoek benoeming vereffenaar. Verzoek van het Rijksvastgoedbedrijf. Verzoeker is geen belanghebbende.	
155	https://uitspraken.rechtspraak.nl/inziendocument?id=ECLI:NL:RBROT:2022:8850&showbutton=true	21-10-2022	26-10-2022	Verbintenissenrecht	Eerste aanleg - enkelvoudig	Rechtspraak.nl	Bedrijfshuur. Conventie: vernietiging verstekvonnis, ontbinding en ontruiming afgewezen, huurschuld ingelopen. Reconventie: gedeeltelijke vernietiging huurovereenkomst afgewezen en ook geen huurprijsvermindering i.v.m. gebreken. Coronakorting toegewezen.	
156	https://uitspraken.rechtspraak.nl/inziendocument?id=ECLI:NL:RBLIM:2022:8183&showbutton=true	21-10-2022	26-10-2022	Personen- en familierecht	Beschikking	Rechtspraak.nl	Vaststelling ouderschap van in 2002 overleden persoon. Met een voldoende mate van zekerheid staat het verwekkerschap vast (zonder DNA onderzoek). IPR:  Wca en Boek 10 niet van toepassing, nu verzoekster is geboren in 1998.	
157	https://uitspraken.rechtspraak.nl/inziendocument?id=ECLI:NL:RBROT:2022:8721&showbutton=true	21-10-2022	26-10-2022	Verbintenissenrecht	Eerste aanleg - enkelvoudig	Rechtspraak.nl	niet gebleken dat de oldtimer niet de kenmerken heeft die de koper op basis van de overeenkomst mocht verwachten, schade door beslag, koper moet gelegde beslag opheffen, verwijzing naar schadestaatprocedure voor verdere schade door beslag.	
158	https://uitspraken.rechtspraak.nl/inziendocument?id=ECLI:NL:RBROT:2022:8722&showbutton=true	21-10-2022	26-10-2022	Verbintenissenrecht	Eerste aanleg - enkelvoudig	Rechtspraak.nl	niet is gebleken dat de oldtimer niet de kenmerken heeft die de koper op grond van de advertentie/overeenkomst mocht verwachten, dus niet kan worden gezegd dat gedaagde een slecht advies heeft gegeven en niet aan de opdracht heeft voldaan. opheffen beslag	
159	https://uitspraken.rechtspraak.nl/inziendocument?id=ECLI:NL:RBROT:2022:8853&showbutton=true	21-10-2022	26-10-2022	Verbintenissenrecht	Eerste aanleg - enkelvoudig	Rechtspraak.nl	Huurzaak. Ontbinding huurovereenkomst. Ontruiming woning. Plus veroordelingen tot betaling.	
160	https://uitspraken.rechtspraak.nl/inziendocument?id=ECLI:NL:RBROT:2022:8869&showbutton=true	21-10-2022	26-10-2022	Civiel recht	Eerste aanleg - enkelvoudig	Rechtspraak.nl	Gebondenheid fiscale clausule echtscheidingsconvenant.	
161	https://uitspraken.rechtspraak.nl/inziendocument?id=ECLI:NL:RBROT:2022:8870&showbutton=true	21-10-2022	26-10-2022	Verbintenissenrecht	Eerste aanleg - enkelvoudig	Rechtspraak.nl	Ontbinding en ontruiming huurwoning toegewezen. Proceskosten uitgesplitst.	
162	https://uitspraken.rechtspraak.nl/inziendocument?id=ECLI:NL:RBROT:2022:8891&showbutton=true	21-10-2022	26-10-2022	Verbintenissenrecht	Eerste aanleg - enkelvoudig	Rechtspraak.nl	verbintenissenrecht, consumentenrecht, herroepingsrecht 6:230oBW	
163	https://uitspraken.rechtspraak.nl/inziendocument?id=ECLI:NL:RBDHA:2022:11098&showbutton=true	21-10-2022	26-10-2022	Insolventierecht	Eerste aanleg - enkelvoudig	Rechtspraak.nl	Afwijzing verzoek WSNP; niets meer vernomen van verzoekers; niet aannemelijk dat de WSNP-verplichtingen zullen worden nagekomen.	
164	https://uitspraken.rechtspraak.nl/inziendocument?id=ECLI:NL:RBDHA:2022:11001&showbutton=true	21-10-2022	27-10-2022	Civiel recht	Kort geding	Rechtspraak.nl	kort geding merkinbreuk	
165	https://uitspraken.rechtspraak.nl/inziendocument?id=ECLI:NL:RBROT:2022:9090&showbutton=true	21-10-2022	27-10-2022	Verbintenissenrecht	Eerste aanleg - enkelvoudig	Rechtspraak.nl	Huurcommissie heeft huurprijs verlaagd in verband met gebreken aan het gehuurde. Verhuurder krijgt de gelegenheid om te bewijzen dat huurder herstel van een van de gebreken (scheefstand van de vloer) heeft geweigerd.	
166	https://uitspraken.rechtspraak.nl/inziendocument?id=ECLI:NL:RBROT:2022:9046&showbutton=true	21-10-2022	27-10-2022	Arbeidsrecht	Beschikking	Rechtspraak.nl	Ontbindingsverzoek werknemer met een slapend dienstverband. Toekenning vergoeding ter hoogte van de transitievergoeding op grond van artikel 7:611 BW. Xella-uitspraak.	
167	https://uitspraken.rechtspraak.nl/inziendocument?id=ECLI:NL:RBMNE:2022:4285&showbutton=true	21-10-2022	28-10-2022	Personen- en familierecht	Beschikking	Rechtspraak.nl	Rechtbank heeft geen nieuwe zitting gepland nadat partijen hebben bericht dat zij toch geen overeenstemming hebben. Eerdere zitting is niet doorgegaan op verzoek van partijen. Partijen mochten zich uitlaten via een akte. Daarna is beslist ogv de stukken.	
168	https://uitspraken.rechtspraak.nl/inziendocument?id=ECLI:NL:RBROT:2022:9186&showbutton=true	21-10-2022	31-10-2022	Verbintenissenrecht	Eerste aanleg - enkelvoudig	Rechtspraak.nl	Non-conformiteit, wettelijke garantie	
169	https://uitspraken.rechtspraak.nl/inziendocument?id=ECLI:NL:RBROT:2022:9187&showbutton=true	21-10-2022	31-10-2022	Verbintenissenrecht	Eerste aanleg - enkelvoudig	"S&E HW 2022/26, UDH:S&E HW/53075 
            
            Rechtspraak.nl"	Toetsing aanvangshuurprijs, schade na einde huur, mondelinge behandeling	
170	https://uitspraken.rechtspraak.nl/inziendocument?id=ECLI:NL:RBLIM:2022:8613&showbutton=true	21-10-2022	04-11-2022	Personen- en familierecht	Kort geding	Rechtspraak.nl	Toevertrouwing kind. Geslaagd beroep op niet-ontvankelijkheid. In plaats van KG had de bijzondere procesgang van artikel 821 tot 826 Rv moeten worden gevolgd.	
171	https://uitspraken.rechtspraak.nl/inziendocument?id=ECLI:NL:RBLIM:2022:8617&showbutton=true	21-10-2022	04-11-2022	Personen- en familierecht	Beschikking	Rechtspraak.nl	Verzoek machtiging gesloten accommodatie aangehouden voor een korte periode. Mj meent dat gesloten plaatsing niet zal helpen. Ter zitting zijn in samenspraak met pleegouders en mj afspraken gemaakt. Mj moet zich strikt houden aan de voorwaarden zoals in de beschikking opgenomen.	
172	https://uitspraken.rechtspraak.nl/inziendocument?id=ECLI:NL:RBROT:2022:9452&showbutton=true	21-10-2022	07-11-2022	Arbeidsrecht	Beschikking	Rechtspraak.nl	Oosv rechtsgeldig; werknemer heeft geen recht op vergoedingen. Echtgenote werknemer heeft zonder toestemming van de werkgever met de zakelijke tankpas van de bedrijfsauto getankt met de privéauto + tankbeurt niet aangewend t.b.v. werkgever.	
173	https://uitspraken.rechtspraak.nl/inziendocument?id=ECLI:NL:RBROT:2022:9152&showbutton=true	21-10-2022	08-11-2022	Verbintenissenrecht	Eerste aanleg - enkelvoudig	Rechtspraak.nl	Huurachterstand ingelopen nadat dagvaarding is uitgebracht; gedaagde is terecht gedagvaard.	
174	https://uitspraken.rechtspraak.nl/inziendocument?id=ECLI:NL:RBAMS:2022:5997&showbutton=true	20-10-2022	20-10-2022	Civiel recht	Kort geding	Rechtspraak.nl	De voorzieningenrechter heeft besloten dat DNBC BV, een in Amsterdam gevestigd bedrijf dat financiële diensten aanbiedt, niet langer de naam DNBC mag gebruiken.	
175	https://uitspraken.rechtspraak.nl/inziendocument?id=ECLI:NL:RBGEL:2022:5906&showbutton=true	20-10-2022	21-10-2022	Civiel recht	Eerste aanleg - enkelvoudig, Kort geding, Op tegenspraak	Rechtspraak.nl	Kort Geding Tarievencode elektriciteit. Deelmarktgrenzen. Gecontracteerd transportvermogen niet beperkt. Liander moet gecontracteerd transportvermogen levering en teruglevering elektriciteit gestand doen.	
176	https://uitspraken.rechtspraak.nl/inziendocument?id=ECLI:NL:RBOVE:2022:3068&showbutton=true	20-10-2022	21-10-2022	Civiel recht	Kort geding	Rechtspraak.nl	Kort geding. Verbod om uitlatingen te doen op sociale media. Verstek verleend tegen niet verschenen gedaagde. Vordering toegewezen nu deze de voorzieningenrechter niet ongegrond of onrechtmatig voorkomt.	
177	https://uitspraken.rechtspraak.nl/inziendocument?id=ECLI:NL:RBGEL:2022:5930&showbutton=true	20-10-2022	24-10-2022	Personen- en familierecht	Eerste aanleg - enkelvoudig, Beschikking	Rechtspraak.nl	"De rechtbank is van oordeel dat discussie over het naamgebruik van de kinderen aangemerkt kan worden als een geschil omtrent het ouderlijk gezag (1:253a BW). Het naamgebruik valt onder de verantwoordelijkheid tot het bevorderen van de ontwikkeling va...  
                 meer"	
178	https://uitspraken.rechtspraak.nl/inziendocument?id=ECLI:NL:RBROT:2022:8834&showbutton=true	20-10-2022	24-10-2022	Civiel recht	Kort geding	Rechtspraak.nl	Kort geding. Opheffen beslag. Gestelde zekerheid moet gerelateerd worden aan de waarde van de auto. Zekerheid komt in plaats van de auto. Verhaalspositie van beslaglegger moet tenminste gelijk blijven.	
179	https://uitspraken.rechtspraak.nl/inziendocument?id=ECLI:NL:RBGEL:2022:5934&showbutton=true	20-10-2022	24-10-2022	Personen- en familierecht	Eerste aanleg - enkelvoudig, Beschikking	Rechtspraak.nl	"De voorzieningenrechter stelt eerst vast dat de man geen juridisch ouder is. Hij heeft het kind niet erkend en zijn vaderschap is niet gerechtelijk vastgesteld. 
Biologisch of juridisch vaderschap is echter geen vereiste om tot een omgangsregeling te...  
                 meer"	
180	https://uitspraken.rechtspraak.nl/inziendocument?id=ECLI:NL:RBOVE:2022:3080&showbutton=true	20-10-2022	24-10-2022	Civiel recht	Wraking	Rechtspraak.nl	Verzoek tot wraking van gehele rechtbank ongegrond verklaard.	
181	https://uitspraken.rechtspraak.nl/inziendocument?id=ECLI:NL:RBROT:2022:8559&showbutton=true	20-10-2022	25-10-2022	Verbintenissenrecht	Eerste aanleg - enkelvoudig	Rechtspraak.nl	Regelgeleide rechtsvinding: of de bestelknop ondubbelzinnig wijst op een betalingsverplichting, is niet contextueel bepaald, maar grammaticaal, waarbij geen acht mag worden geslagen op de verdere omstandigheden van het bestelproces.	
182	https://uitspraken.rechtspraak.nl/inziendocument?id=ECLI:NL:RBROT:2022:8411&showbutton=true	20-10-2022	25-10-2022	Verbintenissenrecht	Eerste aanleg - enkelvoudig	Rechtspraak.nl	verstekvonnis; gedaagde heeft gebruik gemaakt van de mogelijkheid om te reageren op de vordering, daarom verstek verleend tegen gedaade	
183	https://uitspraken.rechtspraak.nl/inziendocument?id=ECLI:NL:RBDHA:2022:10987&showbutton=true	20-10-2022	26-10-2022	Civiel recht	Kort geding	Rechtspraak.nl	Vordering inzetten extra keuringspersoneel door NVWA afgewezen. Geen sprake van onvoorwaardelijke toezegging/garantie; op NVWA rust wel inspanningsverplichting; niet aannemelijk dat NVWA zich onvoldoende heeft ingezet.	
184	https://uitspraken.rechtspraak.nl/inziendocument?id=ECLI:NL:RBDHA:2022:10988&showbutton=true	20-10-2022	27-10-2022	Civiel recht	Kort geding	Rechtspraak.nl	Vordering eisers tot evacuatie/overbrenging naar Nederland afgewezen; geen sprake van specifiek jegens eisers gedane toezegging en eisers evenmin anders gerechtvaardigd op mogen vertrouwen dat zij zouden worden geëvacueerd/overgebracht.	
185	https://uitspraken.rechtspraak.nl/inziendocument?id=ECLI:NL:RBGEL:2022:6081&showbutton=true	20-10-2022	28-10-2022	Civiel recht	Kort geding	Rechtspraak.nl	Locatie- en contactverbod	
186	https://uitspraken.rechtspraak.nl/inziendocument?id=ECLI:NL:RBZWB:2022:6158&showbutton=true	20-10-2022	24-10-2022	Personen- en familierecht	Eerste aanleg - enkelvoudig	"GZR-Updates.nl 2022-0280 
            
            Rechtspraak.nl"	"Kinderrechter verleent ondertoezichtstelling voor drie maanden en houdt aan om GI gelegenheid te bieden tot tussenrapportage:  het kan niet zo zijn dat in deze ernstige zaak een ondertoezichtstelling begeleiding pas na een wachttijd van maanden start...  
                 meer"	
187	https://uitspraken.rechtspraak.nl/inziendocument?id=ECLI:NL:RBROT:2022:8852&showbutton=true	20-10-2022	26-10-2022	Arbeidsrecht	Beschikking	"AR-Updates.nl 2022-1200 
            
            Rechtspraak.nl"	ontslag op staande voet; dringende reden; bewijslast werkgever betrokkenheid werknemer bij diefstal cq. verduistering goederen uit het bedrijf	
188	https://uitspraken.rechtspraak.nl/inziendocument?id=ECLI:NL:RBLIM:2022:8150&showbutton=true	20-10-2022	28-10-2022	Civiel recht	Kort geding	"Module Aanbesteding 2022/1905 
            
            Rechtspraak.nl"	"Aanbestedingsrecht. Leger des Heils heeft niet aannemelijk gemaakt dat de gemeente in deze aanbestedingsprocedure onvoldoende transparant is geweest of zich niet heeft gehouden aan andere algemene beginselen van het aanbestedingsrecht of van behoorli...  
                 meer"	
189	https://uitspraken.rechtspraak.nl/inziendocument?id=ECLI:NL:RBNHO:2022:9333&showbutton=true	20-10-2022	25-10-2022	Verbintenissenrecht	Kort geding	"Module Aanbesteding 2022/1907 
            
            Rechtspraak.nl"	Levering verkochte gemeentegrond. Strijd met Didam-arrest? Mocht de gemeente o.g.v. objectieve, toetsbare en redelijke criteria aannemen dat er slechts één serieuze gegadigde was? Vorderingen afgewezen.	
190	https://uitspraken.rechtspraak.nl/inziendocument?id=ECLI:NL:RBDHA:2022:11350&showbutton=true	20-10-2022	02-11-2022	Civiel recht	Kort geding	Rechtspraak.nl	Kort geding. Verkoopprocedure voormalig Pieter Baan Centrum. Ter beoordeling ligt voor of de biedboekprocedure op zorgvuldige wijze heeft plaatsgevonden. Dat is naar voorshands oordeel het geval. Afwijzing vorderingen.	
191	https://uitspraken.rechtspraak.nl/inziendocument?id=ECLI:NL:RBROT:2022:9259&showbutton=true	20-10-2022	02-11-2022	Verbintenissenrecht	Eerste aanleg - enkelvoudig	Rechtspraak.nl	Tv is non-conform - verkoper moet tot reparatie overgaan dan wel een nieuwe leveren	
192	https://uitspraken.rechtspraak.nl/inziendocument?id=ECLI:NL:RBNNE:2022:3989&showbutton=true	20-10-2022	03-11-2022	Personen- en familierecht	Eerste aanleg - meervoudig	Rechtspraak.nl	"Beëindiging van het gezag van moeder; vader is onbekend en heeft geen gezag. Voldaan aan het criteria van artikel 1:266 lid 1 BW en artikel 8 EVRM. Niet gebleken of aannemelijk gemaakt dat moeder in staat is te achten om binnen afzienbare tijd zelf d...  
                 meer"	
193	https://uitspraken.rechtspraak.nl/inziendocument?id=ECLI:NL:RBNNE:2022:3990&showbutton=true	20-10-2022	03-11-2022	Personen- en familierecht	Eerste aanleg - meervoudig	Rechtspraak.nl	"Beëindiging van het gezag van moeder; vader is onbekend en heeft geen gezag. Voldaan aan het criteria van artikel 1:266 lid 1 BW en artikel 8 EVRM. Niet gebleken of aannemelijk gemaakt dat moeder in staat is te achten om binnen afzienbare tijd zelf d...  
                 meer"	
194	https://uitspraken.rechtspraak.nl/inziendocument?id=ECLI:NL:RBDHA:2022:11276&showbutton=true	20-10-2022	03-11-2022	Personen- en familierecht	Eerste aanleg - enkelvoudig	Rechtspraak.nl	"Afwijzing machtiging tot uithuisplaatsing in een gesloten accommodatie voor jeugdhulp. Het betreft een afwijzing van het aangehouden deel van het verzoek. De gecertificeerde instelling wilde geleidelijk en op een rustig tempo naar een thuisplaatsing ...  
                 meer"	
195	https://uitspraken.rechtspraak.nl/inziendocument?id=ECLI:NL:RBROT:2022:9379&showbutton=true	20-10-2022	04-11-2022	Insolventierecht	Eerste aanleg - enkelvoudig	Rechtspraak.nl	Faillietverklaring afgewezen. Vorderingsrecht verzoekster is niet summierlijk gebleken. Verweerster ontkent rechtsverhouding en daarmee grondslag vordering. De personen en opdrachten zijn niet bekend bij verweerster. Voor nader onderzoek naar de gang van zaken is in een faillissementsprocedure geen ruimte.	
196	https://uitspraken.rechtspraak.nl/inziendocument?id=ECLI:NL:RBDHA:2022:11169&showbutton=true	20-10-2022	07-11-2022	Personen- en familierecht	Beschikking	Rechtspraak.nl	Echtscheiding met nevenvoorzieningen. De vrouw verblijft in de PI, vanwege een ernstig incident waarbij de vrouw het kind – naar het zich laat aanzien in een psychose – heeft gemutileerd.	
197	https://uitspraken.rechtspraak.nl/inziendocument?id=ECLI:NL:RBDHA:2022:11360&showbutton=true	20-10-2022	03-11-2022	Civiel recht	Kort geding	Rechtspraak.nl	Kort geding. Vordering om persoonsgegevens arts aan eiser te verstrekken ten behoeve van een te voeren klachtprocedure afgewezen. Belangenafweging.	
198	https://uitspraken.rechtspraak.nl/inziendocument?id=ECLI:NL:RBROT:2022:8615&showbutton=true	19-10-2022	19-10-2022	Civiel recht	Eerste aanleg - enkelvoudig	Rechtspraak.nl	Vonnis in incident tot zekerheidstelling proceskosten	
199	https://uitspraken.rechtspraak.nl/inziendocument?id=ECLI:NL:RBDHA:2022:10743&showbutton=true	19-10-2022	19-10-2022	Verbintenissenrecht	Kort geding	Rechtspraak.nl	"Het door de minister ingestelde jachtverbod voor jacht op de haas in de provincies Groningen, Limburg en Utrecht hoeft niet buiten toepassing te worden gelaten. Op grond van de plaatsing van de haas op de zogenoemde Rode Lijst en de conclusie van WEN...  
                 meer"	
200	https://uitspraken.rechtspraak.nl/inziendocument?id=ECLI:NL:RBROT:2022:8625&showbutton=true	19-10-2022	19-10-2022	Civiel recht	Eerste aanleg - enkelvoudig	Rechtspraak.nl	"Bevoegdheidsincidenten. Rechtsmacht. Artikel 6 aanhef en onder 1 EVEX II. Aanhouding. Connexiteit. Artikel 34 Brussel I bis-Vo.
Eisers maken deel uit van traditionele leefgemeenschappen (waaronder de Quilombolas) in en rond Barcarena in het Braziliaa...  
                 meer"	
201	https://uitspraken.rechtspraak.nl/inziendocument?id=ECLI:NL:RBROT:2022:8638&showbutton=true	19-10-2022	19-10-2022	Burgerlijk procesrecht	Eerste aanleg - enkelvoudig	Rechtspraak.nl	"Eindvonnis na bewijsopdracht(ECLI:NL:RBROT:2021:2443). Getuigenbewijs. Afwijzing vorderingen wegens schending artikel 21 Rv. Vervalst bewijsmiddel. Bewijs dat contante betaalafspraak is gemaakt geslaagd. In voorgaand tussenvonnis vastgesteld dat de d...  
                 meer"	
202	https://uitspraken.rechtspraak.nl/inziendocument?id=ECLI:NL:RBDHA:2022:10738&showbutton=true	19-10-2022	20-10-2022	Intellectueel-eigendomsrecht	Kort geding	Rechtspraak.nl	"C-09-633991 - KG ZA 22-753.
Vordering van Puma om Brooks in kort geding te verbieden het Uniemerk ‘Nitro’ te gebruiken wordt afgewezen. Het merk beschrijft een kenmerk van de schoen. Daarnaast geldt dat Brooks de aanduiding ‘Nitro’ steeds gebruikt in combinatie met het merk Brooks."	
203	https://uitspraken.rechtspraak.nl/inziendocument?id=ECLI:NL:RBZWB:2022:6016&showbutton=true	19-10-2022	21-10-2022	Civiel recht	Bodemzaak	Rechtspraak.nl	Onderhoudswerkzaamheden aan compressor. Onzorgvuldig handelen onderhoudsmonteur.	
204	https://uitspraken.rechtspraak.nl/inziendocument?id=ECLI:NL:RBNHO:2022:9059&showbutton=true	19-10-2022	24-10-2022	Civiel recht	Bodemzaak	Rechtspraak.nl	Vrijwaringsincident, referte. Toewijzing oproeping in vrijwaring.	
205	https://uitspraken.rechtspraak.nl/inziendocument?id=ECLI:NL:RBNHO:2022:9060&showbutton=true	19-10-2022	24-10-2022	Civiel recht	Bodemzaak	Rechtspraak.nl	Vrijwaringsincident, referte. Toewijzing oproeping in vrijwaring.	
206	https://uitspraken.rechtspraak.nl/inziendocument?id=ECLI:NL:RBAMS:2022:5936&showbutton=true	19-10-2022	24-10-2022	Civiel recht	Eerste aanleg - enkelvoudig	Rechtspraak.nl	Vordering tot betaling uit kortdurende leningsovereenkomst. Uitleg. Haviltex. Is overeenkomst enkel opgesteld ter omzeiling van interne voorschriften? Bevrijdende betaling?	
207	https://uitspraken.rechtspraak.nl/inziendocument?id=ECLI:NL:RBAMS:2022:5738&showbutton=true	19-10-2022	24-10-2022	Civiel recht	Eerste aanleg - meervoudig	Rechtspraak.nl	Beoordeling rechtsgeldigheid opzegging bancaire relatie Viruswaarheid.nl na frustreren klantonderzoek.	
208	https://uitspraken.rechtspraak.nl/inziendocument?id=ECLI:NL:RBZWB:2022:6081&showbutton=true	19-10-2022	25-10-2022	Civiel recht	Bodemzaak	Rechtspraak.nl	Huur. Afrekening servicekosten. Overeengekomen voorschotbedrag ziet op gas, water en elektraverbruik. Dit betekent dat voor wat betreft de elektra huurder uitsluitend de kosten voor het verbruik verschuldigd is; leidt tot afwijzing transformatorkosten.	
