	Instantie	Datum uitspraak	Datum publicatie	Zaaknummer	Rechtsgebieden	Bijzondere kenmerken	Inhoudsindicatie	Vindplaatsen		Wetsverwijzingen	Formele relaties
128	Rechtbank Noord-Holland	25-10-2022	25-10-2022	10104937 \ KG EXPL 22-83	Civiel recht	Eerste aanleg - enkelvoudig	Huurder krijgt gedragsaanwijzing opgelegd na klachtenregen en handtekeningenactie van omwonenden. Verslavingsproblematiek, iav behandeling GGZ. Bij overtreding voorwaarden alsnog ontruiming.	Rechtspraak.nl	Verrijkte uitspraak		
129	Rechtbank Amsterdam	25-10-2022	25-10-2022	C/13/722703 / KG ZA 22-802	Civiel recht	Kort geding	De AFM hoeft een aangifte van handel met voorwetenschap door twee handelaren niet in te trekken of aan te passen. De AFM handelt niet onrechtmatig door haar standpunt te handhaven dat zij een redelijk vermoeden van handel met voorwetenschap heeft, ook al vindt zij dat de compliance officer van het bedrijf waar de handelaren voor werken geen verwijt kan worden gemaakt van het niet doen van een zgn SPOR melding (ex artikel 16 lid 2 MAR). Het is aan het OM om te beslissen al dan niet tot vervolging over te gaan, en vervolgens aan de strafrechter om de zaak te beoordelen.	Rechtspraak.nl	Verrijkte uitspraak		
130	Rechtbank Gelderland	25-10-2022	26-10-2022	C/05/409945 / JE RK 22-1229	Personen- en familierecht	"Eerste aanleg - enkelvoudig
Beschikking"	De minderjarige die onder voogdij staat heeft op grond van artikel 1:265d BW een verzoek gedaan tot opheffing van de gesloten plaatsing. Formeel gezien heeft dit artikel betrekking op de situatie waarin een of beide ouders het gezag hebben. De kinderrechter is echter van oordeel dat artikel 6:265d op grond van artikel 8 EVRM en 16 IVRK van overeenkomstige toepassing moet worden verklaard, waardoor de minderjarige ontvankelijk is in zijn verzoek. Nu er echter geen sprake is van een relevante wijziging van omstandigheden en nog steeds voldaan wordt aan de criteria van artikel 6.1.2 Jeugdwet, wijst de kinderrechter het verzoek af.	Rechtspraak.nl	Verrijkte uitspraak		
131	Rechtbank Rotterdam	25-10-2022	27-10-2022	C/10/645277 / KG ZA 22-821	Civiel recht	Kort geding	Kort geding. Gevorderd contactverbod voor zus wordt toegewezen. Uitzondering dat contact geoorloofd is wanneer de gezondheidstoestand van moeder dat vergt.	Rechtspraak.nl	Verrijkte uitspraak		
132	Rechtbank Rotterdam	25-10-2022	27-10-2022	C/10/645638 / FA RK 22-6960	Personen- en familierecht	Beschikking	Verplichte zorg bij anorexia nervosa purgerende type. Het gaat inmiddels beter en de verplichte zorg kan iets worden verminderd. Toch is er nog verplichte zorg nodig in de vorm van verplichte medische controles, therapeutische maatregelen en ambulante hulpverlening. Een opname is momenteel niet voorzienbaar. Het eigen plan van aanpak, waarin staat dat betrokkene geen behandeling meer wil, komt nog iets te vroeg.	Rechtspraak.nl	Verrijkte uitspraak		
133	Rechtbank Overijssel	25-10-2022	27-10-2022	C/08/285268 / KG ZA 22-194	Civiel recht	Kort geding	Eiseres vordert medewerking van gedaagde aan het ondertekenen van een opdrachtovereenkomst inzake de waardebepaling van gezamenlijke onderneming. Vorderingen worden afgewezen vanwege het ontbreken van spoedeisend belang.	Rechtspraak.nl	Verrijkte uitspraak		
134	Rechtbank Overijssel	25-10-2022	27-10-2022	9848034 \ CV EXPL  22-973	Civiel recht	Eerste aanleg - enkelvoudig	Eiser heeft een motorboot gekocht van gedaagde en stelt dat de boot non-conform is, omdat (de motor van) de boot niet voldoet aan de verwachtingen die hij daarvan mocht hebben. Gedaagde betwist dit en stelt dat hij aan zijn mededelingsplicht heeft voldaan, dat eiser niet aan zijn onderzoeksplicht heeft voldaan en dat de oorzaak van het gebrek niet vaststaat. De gevorderde schadeposten worden door hem betwist. De kantonrechter oordeelt dat de boot niet de eigenschappen bezit die eiser op grond van de overeenkomst mocht verwachten. Naar het oordeel van de kantonrechter gaat de mededelingsplicht van gedaagde boven de onderzoeksplicht van eiser en had gedaagde moeten weten en mededelen dat de staat van de motor slecht was. Eiser heeft de overeenkomst rechtsgeldig ontbonden. De kantonrechter wijst de vordering tot terugbetaling van de koopsom toe. De gevorderde schadevergoeding wordt slechts gedeeltelijk toegewezen.	Rechtspraak.nl	Verrijkte uitspraak		
135	Rechtbank Den Haag	25-10-2022	28-10-2022	C/09/635923 / KG ZA 22/881	Civiel recht	Kort geding	Kort geding. Dat gedaagden zich onrechtmatig over eiseres hebben uitgelaten door negatieve ervaringen in een Whatsapp-groep te delen of dat zij onrechtmatig jegens eiseres hebben gehandeld is niet aannemelijk geworden. De vorderingen worden afgewezen.	Rechtspraak.nl	Verrijkte uitspraak		
136	Rechtbank Amsterdam	25-10-2022	28-10-2022	9833647 CV EXPL 22-5582	Civiel recht	Eerste aanleg - enkelvoudig	Een leasebedrijf moet een leaserijder ruim 4.000 euro terugbetalen.	Rechtspraak.nl	Verrijkte uitspraak		
137	Rechtbank Zeeland-West-Brabant	25-10-2022	26-10-2022	10055277 AZ VERZ 22-39	Civiel recht	Bodemzaak	Ontslag op staande voet. De rectificatie van de partijaanduiding in het verzoekschrift wordt toegestaan. Het was voor de bestuurder kenbaar tegen wie het verzoek was gericht. De partij is niet benadeeld door de vergissing én de rectificatie en zij is daardoor niet in haar verdediging geschaad.	"Rechtspraak.nl 
AR-Updates.nl 2022-1179"	Verrijkte uitspraak		
138	Rechtbank Overijssel	25-10-2022	27-10-2022	10100070 \ CV EXPL  22-2097	Arbeidsrecht	Kort geding	Ontslag op staande voet ten onrechte gegeven. Geen sprake van een dringende reden.	"Rechtspraak.nl 
AR-Updates.nl 2022-1202"	Verrijkte uitspraak		
139	Rechtbank Midden-Nederland	25-10-2022	31-10-2022	545346 / HA RK 22-203	Civiel recht	Wraking	Wrakingszaak. Niet beslissen voorafgaand of aan het begin van de zitting over het al dan niet nemen van een akte is een procesbeslissing. Hieruit blijkt niet van vooringenomenheid. Het opmaken van een proces-verbaal buiten partijen is geen grond voor wraking. Wrakingsverzoek ongegrond.	Rechtspraak.nl	Verrijkte uitspraak		
140	Rechtbank Midden-Nederland	25-10-2022	31-10-2022	545133 / HA RK 22-199	Civiel recht	Wraking	Wrakingszaak. Wrakingsgrond dat de rechter niet naar verzoeker wilde luisteren en verzoeker daarom niet zo wordt behandeld als andere Nederlanders slaagt niet. dit blijkt niet uit het proces-verbaal van zitting. Wrakingsverzoek ongegrond.	Rechtspraak.nl	Verrijkte uitspraak		
141	Rechtbank Overijssel	25-10-2022	31-10-2022	9962857 \ CV EXPL  22-2275	Civiel recht	"Eerste aanleg - enkelvoudig
Tussenuitspraak"	Gevorderde ontruiming wegens huurachterstand. Gedaagde wordt in de gelegenheid gesteld om te bewijzen dat hij de huur heeft voldaan.	Rechtspraak.nl	Verrijkte uitspraak		
142	Rechtbank Limburg	25-10-2022	01-11-2022	9958107\AZ22-62 25102022	Arbeidsrecht	Eerste aanleg - enkelvoudig	Ontslag tijdens proeftijd. Verzoekster wordt nog voordat ze in dienst getreden is bij werkgever ontslagen. Verzoekster is gediagnostiseerd met een agressieve vorm van longkanker en zij meldt dit bij haar nieuwe werkgever. Verzoekster vecht het proeftijdontslag aan. Kantonrechter is van oordeel dat werkgever gehandeld heeft in strijd met het bepaalde in artikel 4 juncto artikel 1 Wgbh/cz en dat er sprake is van een onrechtmatige en discriminatoire opzegging. Aan verzoekster wordt op grond van het bepaalde in artikel 7:681 lid 1 onder c BW een billijke vergoeding toegekend van € 33.000,00 bruto. De kantonrechter kent geen immateriële schadevergoeding toe omdat de ziekte van werkneemster op geen enkele wijze terug te voeren is op het handelen of de houding van werkgever.	Rechtspraak.nl	Verrijkte uitspraak		
143	Rechtbank Amsterdam	25-10-2022	06-11-2022	9424722  CV EXPL 21-12789	Civiel recht	Eerste aanleg - enkelvoudig	Huurders hebben onjuiste inlichtingen aan verhuurster verstrekt. Verklaring voor recht dat de huurovereenkomst op grond van dwaling buitengerechtelijk is vernietigd.	Rechtspraak.nl	Verrijkte uitspraak		
144	Rechtbank Overijssel	25-10-2022	02-11-2022	9643480 \ CV EXPL 22-221	Civiel recht	Eerste aanleg - enkelvoudig	Eindvonnis in vrijwaringszaak. Eiseres in vrijwaring heeft onvoldoende onderbouwd dat zij gedaagde in vrijwaring kent en dat hij verantwoordelijk is voor de Whatsappfraude waarvoor zij in de hoofdzaak is veroordeeld.	Rechtspraak.nl	Verrijkte uitspraak		Tussenuitspraak:  ECLI:NL:RBOVE:2022:1680
145	Rechtbank Den Haag	25-10-2022	09-11-2022	C/09/624028 / HA RK 22-24	Civiel recht	Beschikking	Verzoek van het Openbaar Ministerie strekkende tot ontslag van bestuurders van een stichting toegewezen.	Rechtspraak.nl	Verrijkte uitspraak		
146	Rechtbank Den Haag	25-10-2022	09-11-2022	C/09/636258 KG ZA 22/895	Civiel recht	Kort geding	Kort geding. Mondeling vonnis 30p Rv. Geldvordering in conventie en opheffing beslag in reconventie worden afgewezen. Geldvordering is onvoldoende aannemelijk en reconventionele vordering is niet onderbouwd.	Rechtspraak.nl	Verrijkte uitspraak		
147	Rechtbank Overijssel	24-10-2022	26-10-2022	C/08/285 162 / KG ZA 22-186	Arbeidsrecht	Kort geding	Concurrentiebeding. De voorzieningenrechter is van oordeel dat eiseres onvoldoende onderbouwd heeft gesteld dat haar bedrijfsdebiet substantieel en stelselmatig wordt afgebroken. In tegendeel, eiseres erkent dat van afbreuk op dit moment nog geen sprake is. De enkele vrees dat dit in de toekomst zal gebeuren, acht de voorzieningenrechter geen reden om op dit moment – bij voorlopige voorziening – gedaagde het verzochte verbod op te leggen. Vorderingen afgewezen.	"Rechtspraak.nl 
AR-Updates.nl 2022-1177"	Verrijkte uitspraak		
148	Rechtbank Amsterdam	24-10-2022	28-10-2022	10076565 EA VERZ 22-522	Civiel recht	Eerste aanleg - enkelvoudig	Ontbinding van de arbeidsovereenkomst is toegewezen	"Rechtspraak.nl 
AR-Updates.nl 2022-1187"	Verrijkte uitspraak		
149	Rechtbank Noord-Nederland	24-10-2022	28-10-2022	10014344 AR VERZ 22-57	Civiel recht	"Op tegenspraak
Beschikking"	Ontbinding van de arbeidsovereenkomst wegens verwijtbaar handelen werknemer; signaal discriminatie, niet meewerken aan intern onderzoek, wijze van benaderen collega’s veroorzaakt onrust binnen werkgever	"Rechtspraak.nl 
AR-Updates.nl 2022-1201"	Verrijkte uitspraak		
150	Rechtbank Rotterdam	24-10-2022	01-11-2022	C/10/641084 / KG ZA 22-589	Aanbestedingsrecht	Kort geding	KG. Gedaagde is overheidslichaam. Mag gedaagde onroerend goed verkopen aan derde zonder openbare selectieprocedure? Toepassing Didam-arrest. Antwoord: Nee. Beroep van gedaagde op uitzondering van dat arrest faalt. Selectieprocedure is vereist.	Rechtspraak.nl	Verrijkte uitspraak		
151	Rechtbank Rotterdam	24-10-2022	07-11-2022	C/10/644743 / KG ZA 22-784	Verbintenissenrecht	Kort geding	KG. Geschil over welke arbeidsovk tussen partijen geldt en of gedaagde na einde ovk inbreuk maakt op bedingen mbt geheimhouding, documenten en non-concurrentie. Gevorderde inzage na bewijsbeslag en kosten afgewezen, onvoldoende bepaalbaar en dubbel.	Rechtspraak.nl	Verrijkte uitspraak		
152	Rechtbank Rotterdam	24-10-2022	07-11-2022	10054452 VV EXPL 22-47	Arbeidsrecht	Kort geding	Kort geding. Niet gevaccineerde werknemer vordrt tewerkstelling in het buitenland. Om diverse redenen geen concrete mogelijkheden voorhanden, dus geen spoed. Hoogte salaris zal bewezen moeten worden. Daar leent kort geding zich niet voor. Afwijzing.	Rechtspraak.nl	Verrijkte uitspraak		
153	Rechtbank Rotterdam	24-10-2022	07-11-2022	10092337 \ VZ VERZ 22-11662	Civiel recht	Beschikking	Oosv houdt geen stand; ‘druppel’ is niet komen vast te staan; in rechte wordt er niet van uitgegaan dat nevenwerkzaamhedenverbod is overtreden; wn is arbeidsongeschikt; voorwaardelijk ontbindingsverzoek niet toewijsbaar vanwege opzegverbod tijdens ziekte.	Rechtspraak.nl	Verrijkte uitspraak		
154	Rechtbank Midden-Nederland	24-10-2022	09-11-2022	535172 HA RK 22-46	Personen- en familierecht	Beschikking	Niet-ontvankelijkverklaring van verzoek benoeming vereffenaar. Verzoek van het Rijksvastgoedbedrijf. Verzoeker is geen belanghebbende.	Rechtspraak.nl	Verrijkte uitspraak		
155	Rechtbank Rotterdam	21-10-2022	26-10-2022	KTN-8779135_211022	Verbintenissenrecht	Eerste aanleg - enkelvoudig	Bedrijfshuur. Conventie: vernietiging verstekvonnis, ontbinding en ontruiming afgewezen, huurschuld ingelopen. Reconventie: gedeeltelijke vernietiging huurovereenkomst afgewezen en ook geen huurprijsvermindering i.v.m. gebreken. Coronakorting toegewezen.	Rechtspraak.nl	Verrijkte uitspraak		
156	Rechtbank Limburg	21-10-2022	26-10-2022	C/03/300587 / FA RK 22-42	Personen- en familierecht	Beschikking	Vaststelling ouderschap van in 2002 overleden persoon. Met een voldoende mate van zekerheid staat het verwekkerschap vast (zonder DNA onderzoek). IPR:  Wca en Boek 10 niet van toepassing, nu verzoekster is geboren in 1998.	Rechtspraak.nl	Verrijkte uitspraak		
157	Rechtbank Rotterdam	21-10-2022	26-10-2022	9507964	Verbintenissenrecht	Eerste aanleg - enkelvoudig	niet gebleken dat de oldtimer niet de kenmerken heeft die de koper op basis van de overeenkomst mocht verwachten, schade door beslag, koper moet gelegde beslag opheffen, verwijzing naar schadestaatprocedure voor verdere schade door beslag.	Rechtspraak.nl	Verrijkte uitspraak		
158	Rechtbank Rotterdam	21-10-2022	26-10-2022	9905866	Verbintenissenrecht	Eerste aanleg - enkelvoudig	niet is gebleken dat de oldtimer niet de kenmerken heeft die de koper op grond van de advertentie/overeenkomst mocht verwachten, dus niet kan worden gezegd dat gedaagde een slecht advies heeft gegeven en niet aan de opdracht heeft voldaan. opheffen beslag	Rechtspraak.nl	Verrijkte uitspraak		
159	Rechtbank Rotterdam	21-10-2022	26-10-2022	KTN-10014522_211022	Verbintenissenrecht	Eerste aanleg - enkelvoudig	Huurzaak. Ontbinding huurovereenkomst. Ontruiming woning. Plus veroordelingen tot betaling.	Rechtspraak.nl	Verrijkte uitspraak		
160	Rechtbank Rotterdam	21-10-2022	26-10-2022	9895788	Civiel recht	Eerste aanleg - enkelvoudig	Gebondenheid fiscale clausule echtscheidingsconvenant.	Rechtspraak.nl	Verrijkte uitspraak		
161	Rechtbank Rotterdam	21-10-2022	26-10-2022	9466857	Verbintenissenrecht	Eerste aanleg - enkelvoudig	Ontbinding en ontruiming huurwoning toegewezen. Proceskosten uitgesplitst.	Rechtspraak.nl	Verrijkte uitspraak		
162	Rechtbank Rotterdam	21-10-2022	26-10-2022	9674080	Verbintenissenrecht	Eerste aanleg - enkelvoudig	verbintenissenrecht, consumentenrecht, herroepingsrecht 6:230oBW	Rechtspraak.nl	Verrijkte uitspraak		
163	Rechtbank Den Haag	21-10-2022	26-10-2022	C/09/632794 / FT RK 22/521	Insolventierecht	Eerste aanleg - enkelvoudig	Afwijzing verzoek WSNP; niets meer vernomen van verzoekers; niet aannemelijk dat de WSNP-verplichtingen zullen worden nagekomen.	Rechtspraak.nl	Verrijkte uitspraak	Faillissementswet 288	
164	Rechtbank Den Haag	21-10-2022	27-10-2022	C/09/632874 / KG ZA 22-681	Civiel recht	Kort geding	kort geding merkinbreuk	Rechtspraak.nl	Verrijkte uitspraak		
165	Rechtbank Rotterdam	21-10-2022	27-10-2022	9639877 CV EXPL 22-1535	Verbintenissenrecht	Eerste aanleg - enkelvoudig	Huurcommissie heeft huurprijs verlaagd in verband met gebreken aan het gehuurde. Verhuurder krijgt de gelegenheid om te bewijzen dat huurder herstel van een van de gebreken (scheefstand van de vloer) heeft geweigerd.	Rechtspraak.nl	Verrijkte uitspraak		
166	Rechtbank Rotterdam	21-10-2022	27-10-2022	9941191	Arbeidsrecht	Beschikking	Ontbindingsverzoek werknemer met een slapend dienstverband. Toekenning vergoeding ter hoogte van de transitievergoeding op grond van artikel 7:611 BW. Xella-uitspraak.	Rechtspraak.nl	Verrijkte uitspraak		
167	Rechtbank Midden-Nederland	21-10-2022	28-10-2022	C/16/506031 / FA RK 20-4225	Personen- en familierecht	Beschikking	Rechtbank heeft geen nieuwe zitting gepland nadat partijen hebben bericht dat zij toch geen overeenstemming hebben. Eerdere zitting is niet doorgegaan op verzoek van partijen. Partijen mochten zich uitlaten via een akte. Daarna is beslist ogv de stukken.	Rechtspraak.nl	Verrijkte uitspraak		
168	Rechtbank Rotterdam	21-10-2022	31-10-2022	9907019	Verbintenissenrecht	Eerste aanleg - enkelvoudig	Non-conformiteit, wettelijke garantie	Rechtspraak.nl	Verrijkte uitspraak		
169	Rechtbank Rotterdam	21-10-2022	31-10-2022	9649486	Verbintenissenrecht	Eerste aanleg - enkelvoudig	Toetsing aanvangshuurprijs, schade na einde huur, mondelinge behandeling	"Rechtspraak.nl 
S&E HW 2022/26, UDH:S&E HW/53075 met annotatie van Gor Gabrelian"	Verrijkte uitspraak		
170	Rechtbank Limburg	21-10-2022	04-11-2022	C/03/310278 / KG ZA 22-387	Personen- en familierecht	Kort geding	Toevertrouwing kind. Geslaagd beroep op niet-ontvankelijkheid. In plaats van KG had de bijzondere procesgang van artikel 821 tot 826 Rv moeten worden gevolgd.	Rechtspraak.nl	Verrijkte uitspraak		
171	Rechtbank Limburg	21-10-2022	04-11-2022	C/03/310260 / JE RK 22-1779	Personen- en familierecht	Beschikking	Verzoek machtiging gesloten accommodatie aangehouden voor een korte periode. Mj meent dat gesloten plaatsing niet zal helpen. Ter zitting zijn in samenspraak met pleegouders en mj afspraken gemaakt. Mj moet zich strikt houden aan de voorwaarden zoals in de beschikking opgenomen.	Rechtspraak.nl	Verrijkte uitspraak		
172	Rechtbank Rotterdam	21-10-2022	07-11-2022	10061343 VZ VERZ 22-10952	Arbeidsrecht	Beschikking	Oosv rechtsgeldig; werknemer heeft geen recht op vergoedingen. Echtgenote werknemer heeft zonder toestemming van de werkgever met de zakelijke tankpas van de bedrijfsauto getankt met de privéauto + tankbeurt niet aangewend t.b.v. werkgever.	Rechtspraak.nl	Verrijkte uitspraak		
173	Rechtbank Rotterdam	21-10-2022	08-11-2022	9750535	Verbintenissenrecht	Eerste aanleg - enkelvoudig	Huurachterstand ingelopen nadat dagvaarding is uitgebracht; gedaagde is terecht gedagvaard.	Rechtspraak.nl	Verrijkte uitspraak		
174	Rechtbank Amsterdam	20-10-2022	20-10-2022	C/13/722366 / KG ZA 22-775	Civiel recht	Kort geding	De voorzieningenrechter heeft besloten dat DNBC BV, een in Amsterdam gevestigd bedrijf dat financiële diensten aanbiedt, niet langer de naam DNBC mag gebruiken.	Rechtspraak.nl	Verrijkte uitspraak		
175	Rechtbank Gelderland	20-10-2022	21-10-2022	C/05/408133 / KG ZA 22-278	Civiel recht	"Eerste aanleg - enkelvoudig
Kort geding
Op tegenspraak"	Kort Geding Tarievencode elektriciteit. Deelmarktgrenzen. Gecontracteerd transportvermogen niet beperkt. Liander moet gecontracteerd transportvermogen levering en teruglevering elektriciteit gestand doen.	Rechtspraak.nl	Verrijkte uitspraak		
176	Rechtbank Overijssel	20-10-2022	21-10-2022	C/08/286613 / KG ZA 22/217	Civiel recht	Kort geding	Kort geding. Verbod om uitlatingen te doen op sociale media. Verstek verleend tegen niet verschenen gedaagde. Vordering toegewezen nu deze de voorzieningenrechter niet ongegrond of onrechtmatig voorkomt.	Rechtspraak.nl	Verrijkte uitspraak		
177	Rechtbank Gelderland	20-10-2022	24-10-2022	C/05/405567 / FA RK 22-1926	Personen- en familierecht	"Eerste aanleg - enkelvoudig
Beschikking"	De rechtbank is van oordeel dat discussie over het naamgebruik van de kinderen aangemerkt kan worden als een geschil omtrent het ouderlijk gezag (1:253a BW). Het naamgebruik valt onder de verantwoordelijkheid tot het bevorderen van de ontwikkeling van de persoonlijkheid en de zorg en verantwoordelijkheid voor het geestelijk welzijn zoals genoemd in artikel 1:247 BW. De rechtbank is van oordeel dat het niet aan de moeder is om de voornaam van de kinderen eenzijdig te wijzigen door een andere roepnaam voor de kinderen te gebruiken. De rechtbank bepaalt dat de kinderen bij alle instanties moeten worden geregistreerd onder hun officiële naam. De beslissing over het gebruik van de voornaam leent zich niet voor een verklaring voor recht, omdat hiermee geen rechtsverhouding tussen partijen wordt vastgesteld.	Rechtspraak.nl	Verrijkte uitspraak		
178	Rechtbank Rotterdam	20-10-2022	24-10-2022	C/10/645979 / KG ZA 22-853	Civiel recht	Kort geding	Kort geding. Opheffen beslag. Gestelde zekerheid moet gerelateerd worden aan de waarde van de auto. Zekerheid komt in plaats van de auto. Verhaalspositie van beslaglegger moet tenminste gelijk blijven.	Rechtspraak.nl	Verrijkte uitspraak		
179	Rechtbank Gelderland	20-10-2022	24-10-2022	C/05/409359 / KG ZA 22-306	Personen- en familierecht	"Eerste aanleg - enkelvoudig
Beschikking"	De voorzieningenrechter stelt eerst vast dat de man geen juridisch ouder is. Hij heeft het kind niet erkend en zijn vaderschap is niet gerechtelijk vastgesteld. Biologisch of juridisch vaderschap is echter geen vereiste om tot een omgangsregeling te komen. Dat er aan de zijde van de vrouw twijfels zijn of de man de biologische vader is, vormt dus geen belemmering om een omgangsregeling vast te stellen. De voorzieningenrechter is van oordeel dat tussen de man en kind een nauwe persoonlijke betrekking bestaat en toetst aan artikel 8 EVRM. De man heeft gedurende zes jaar een vaderrol gespeeld in het leven van het kind. Omdat er tijdens de relatie sprake was van veel ruzies en (verbaal), ook in het bijzijn van het kind, stelt de voorzieningenrechter een begeleide regeling vast.	Rechtspraak.nl	Verrijkte uitspraak		
180	Rechtbank Overijssel	20-10-2022	24-10-2022	C/08/286697 / KG RK 22-405	Civiel recht	Wraking	Verzoek tot wraking van gehele rechtbank ongegrond verklaard.	Rechtspraak.nl	Verrijkte uitspraak		
181	Rechtbank Rotterdam	20-10-2022	25-10-2022	9876205 CV EXPL 22-1948	Verbintenissenrecht	Eerste aanleg - enkelvoudig	Regelgeleide rechtsvinding: of de bestelknop ondubbelzinnig wijst op een betalingsverplichting, is niet contextueel bepaald, maar grammaticaal, waarbij geen acht mag worden geslagen op de verdere omstandigheden van het bestelproces.	Rechtspraak.nl	Verrijkte uitspraak		
182	Rechtbank Rotterdam	20-10-2022	25-10-2022	10074509 CV EXPL 22-3400	Verbintenissenrecht	Eerste aanleg - enkelvoudig	verstekvonnis; gedaagde heeft gebruik gemaakt van de mogelijkheid om te reageren op de vordering, daarom verstek verleend tegen gedaade	Rechtspraak.nl	Verrijkte uitspraak		
183	Rechtbank Den Haag	20-10-2022	26-10-2022	C/09/634806 22-802	Civiel recht	Kort geding	Vordering inzetten extra keuringspersoneel door NVWA afgewezen. Geen sprake van onvoorwaardelijke toezegging/garantie; op NVWA rust wel inspanningsverplichting; niet aannemelijk dat NVWA zich onvoldoende heeft ingezet.	Rechtspraak.nl	Verrijkte uitspraak		
184	Rechtbank Den Haag	20-10-2022	27-10-2022	C/09/634937 KG ZA 22-813	Civiel recht	Kort geding	Vordering eisers tot evacuatie/overbrenging naar Nederland afgewezen; geen sprake van specifiek jegens eisers gedane toezegging en eisers evenmin anders gerechtvaardigd op mogen vertrouwen dat zij zouden worden geëvacueerd/overgebracht.	Rechtspraak.nl	Verrijkte uitspraak		
185	Rechtbank Gelderland	20-10-2022	28-10-2022	C/05/408923 / KZ ZA 22-146	Civiel recht	Kort geding	Locatie- en contactverbod	Rechtspraak.nl	Verrijkte uitspraak		
186	Rechtbank Zeeland-West-Brabant	20-10-2022	24-10-2022	C/02/402022 JERK 22-174	Personen- en familierecht	Eerste aanleg - enkelvoudig	Kinderrechter verleent ondertoezichtstelling voor drie maanden en houdt aan om GI gelegenheid te bieden tot tussenrapportage:  het kan niet zo zijn dat in deze ernstige zaak een ondertoezichtstelling begeleiding pas na een wachttijd van maanden start: gewezen op andere mogelijkheden, zo als inzet Gezinsadvocaat od Schottenaanpak. Niets doen is geen optie.	"Rechtspraak.nl 
GZR-Updates.nl 2022-0280"	Verrijkte uitspraak		
187	Rechtbank Rotterdam	20-10-2022	26-10-2022	10049979 HA VERZ 22-66 en 10051999 HA VERZ 22-68	Arbeidsrecht	Beschikking	ontslag op staande voet; dringende reden; bewijslast werkgever betrokkenheid werknemer bij diefstal cq. verduistering goederen uit het bedrijf	"Rechtspraak.nl 
AR-Updates.nl 2022-1200"	Verrijkte uitspraak		
188	Rechtbank Limburg	20-10-2022	28-10-2022	C/03/308625 / KG ZA 22-320	Civiel recht	Kort geding	Aanbestedingsrecht. Leger des Heils heeft niet aannemelijk gemaakt dat de gemeente in deze aanbestedingsprocedure onvoldoende transparant is geweest of zich niet heeft gehouden aan andere algemene beginselen van het aanbestedingsrecht of van behoorlijk bestuur. Evenmin heeft Leger des Heils aannemelijk gemaakt dat de kostprijselementen op onjuiste wijze bij de berekening van het betreffende tarief zijn meegenomen, zodat ook niet aannemelijk is geworden dat dit tarief niet reëel is. Van onrechtmatig handelen door de gemeente is dan ook geen sprake, zodat de vorderingen worden afgewezen.	"Rechtspraak.nl 
Module Aanbesteding 2022/1905"	Verrijkte uitspraak		
189	Rechtbank Noord-Holland	20-10-2022	25-10-2022	C/15/330491 / KG ZA 22-388	Verbintenissenrecht	Kort geding	Levering verkochte gemeentegrond. Strijd met Didam-arrest? Mocht de gemeente o.g.v. objectieve, toetsbare en redelijke criteria aannemen dat er slechts één serieuze gegadigde was? Vorderingen afgewezen.	"Rechtspraak.nl 
Module Aanbesteding 2022/1907"	Verrijkte uitspraak		
190	Rechtbank Den Haag	20-10-2022	02-11-2022	C/09/633648 / KG ZA 22-729	Civiel recht	Kort geding	Kort geding. Verkoopprocedure voormalig Pieter Baan Centrum. Ter beoordeling ligt voor of de biedboekprocedure op zorgvuldige wijze heeft plaatsgevonden. Dat is naar voorshands oordeel het geval. Afwijzing vorderingen.	Rechtspraak.nl	Verrijkte uitspraak		
191	Rechtbank Rotterdam	20-10-2022	02-11-2022	10015312	Verbintenissenrecht	Eerste aanleg - enkelvoudig	Tv is non-conform - verkoper moet tot reparatie overgaan dan wel een nieuwe leveren	Rechtspraak.nl	Verrijkte uitspraak		
