	Instantie	Datum uitspraak	Datum publicatie	Zaaknummer	Rechtsgebieden	Bijzondere kenmerken	Inhoudsindicatie	Vindplaatsen		Wetsverwijzingen	Formele relaties
0	Rechtbank Den Haag	09-11-2022	09-11-2022	C-09-632745-KG ZA 22-669	Civiel recht	Kort geding	Kort geding. Vordering om Staat te verbieden eiser uit te leveren aan Australië en/of nader onderzoek te doen of nadere garanties te vragen afgewezen. Geen reëel risico op een levenslange gevangenisstraf na uitlevering. Vordering tot afgifte van stukken ook afgewezen. Interstatelijke vertrouwelijkheid.	Rechtspraak.nl	Verrijkte uitspraak		
1	Rechtbank Den Haag	09-11-2022	09-11-2022	C/09/609567 / HA ZA 21-300	Civiel recht	"Bodemzaak
Eerste aanleg - meervoudig"	Beroep op volledige nadeelscompensatie (voor onevenredige schade door coronamaatregelen) horecaondermemers op grond van het égalitébeginsel slaagt niet.	Rechtspraak.nl	Verrijkte uitspraak		
2	Rechtbank Den Haag	09-11-2022	09-11-2022	C/09/601949 / HA ZA 20-1067	Civiel recht	"Bodemzaak
Eerste aanleg - meervoudig"	Geschil over het uit de VVD-fractie zetten van een Eerste Kamerlid. De beslissing een lid uit een fractie van een partij te zetten betreft politieke besluitvorming en speelt zich af in een autonome politieke sfeer, waarbij voor rechterlijk ingrijpen geen plaats is.De vorderingen van eiseressen dat gedaagden ook los van de voornoemde beslissing onrechtmatig jegens eiseressen hebben gehandeld en schadeplichtig zijn worden afgewezen.	Rechtspraak.nl	Verrijkte uitspraak		
3	Rechtbank Den Haag	07-11-2022	08-11-2022	C/09/623033 / FA RK 21-8848	Personen- en familierecht	Beschikking	Vaststellen van een verlengde onderhoudsplicht bij een dochter van 22 jaar oud. De rechtbank oordeelt dat er sprake is van een natuurlijke verbintenis op grond waarvan de vader ook ná het 21e levensjaar van de minderjarige kinderalimentatie moet betalen.	Rechtspraak.nl	Verrijkte uitspraak		
4	Rechtbank Rotterdam	04-11-2022	04-11-2022	C/10/645656 / KG ZA 22-837	Civiel recht	Kort geding	Kort geding; vordering tegen bestuurdersaansprakelijkheidsverzekeraar tot vergoeding van (niet gespecificeerde) kosten van verweer. Dat verweer betreft een hoger beroep tegen een beschikking waarin eisers zijn ontslagen als bestuurders van een stichting. De vordering wordt afgewezen omdat niet wordt voldaan aan de eisen van een geldvordering in kort geding. Het spoedeisend belang bij die vordering is niet geconcretiseerd en evenmin onderbouwd. Van een aannemelijke vordering is ook geen sprake en tot slot is de vordering onvoldoende bepaalbaar.	Rechtspraak.nl	Verrijkte uitspraak		
5	Rechtbank Midden-Nederland	04-11-2022	04-11-2022	10109143 / MV EXPL  22-117 (HHt/37278 ) van	Civiel recht	Kort geding	Deze zaak gaat over overlast. Woonpalet heeft in de loop van 2021 veel overlastmeldingen over de huurders van de (directe) buren ontvangen. Ondanks de inzet van Woonpalet, politie, gemeente en de betrokken hulpverlenende instanties wordt de door huurders veroorzaakte overlast niet minder. De huurders hebben zich niet gedragen als goede huurders, omdat zij ernstige overlast hebben veroorzaakt aan hun (directe) buren. Van de (directe) buren kan dan ook niet langer worden gevraagd de overlast te dulden. De belangenafweging pakt in het nadeel van de huurders uit. De huurders moeten de woning ontruimen en verlaten. De huurders krijgen vanwege de kwetsbare situatie van één van de huurders, een langere ontruimingstermijn van 4 weken.	Rechtspraak.nl	Verrijkte uitspraak		
6	Rechtbank Rotterdam	04-11-2022	07-11-2022	C/10/644020 / HA ZA 22-706	Verbintenissenrecht	Proces-verbaal	NVM-koopakte. Eén van de kopers beroept zich op (onder andere) ontbreken van wil, dwaling en ontbinding binnen de 7:2-BW-termijn. Alle verweren verworpen. Boete gematigd.	Rechtspraak.nl	Verrijkte uitspraak		
7	Rechtbank Rotterdam	04-11-2022	07-11-2022	9794375	Verbintenissenrecht	Eerste aanleg - enkelvoudig	Gemengde overeenkomst van aanneming en koop. Gordijnen beantwoorden niet aan de overeenkomst. Rechtsgeldige buitengerechtelijke ontbinding. Artikel 6:272 BW	Rechtspraak.nl	Verrijkte uitspraak		
8	Rechtbank Rotterdam	04-11-2022	07-11-2022	9980957 CV EXPL 22-20329	Verbintenissenrecht	Eerste aanleg - enkelvoudig	Bewoning trainingswoning als gevolg van justitiële maatregel zonder schriftelijke huurovereenkomst; voldaan aan de vereisten van een huurovereenkomst	Rechtspraak.nl	Verrijkte uitspraak		
9	Rechtbank Rotterdam	04-11-2022	07-11-2022	C/10/645924 / KG ZA 22-849	Civiel recht	Kort geding	Kort geding. De dagvaarding is betekend aan het postadres van gedaagde dat volgt uit de BRP. Verstek verleend. Gedaagde wordt veroordeeld tot het geven van een verklaring wat er met de door hem in ontvangst genomen zending is gebeurd. Dwangsom.	Rechtspraak.nl	Verrijkte uitspraak		
10	Rechtbank Zeeland-West-Brabant	04-11-2022	08-11-2022	10084071_E04112022	Civiel recht	Bodemzaak	Vordering van gemeente tot ontruiming toegewezen; spoedeisend belang; beslissing dat huurovereenkomst rechtsgeldig door opzegging is geëindigd heeft gezag van gewijsde; stichting maakt zonder recht of titel gebruik van gehuurde; geen misbruik van recht.	Rechtspraak.nl	Verrijkte uitspraak		
11	Rechtbank Rotterdam	04-11-2022	08-11-2022	9573256 \ CV EXPL 21-40038	Civiel recht	Eerste aanleg - enkelvoudig	Geldvordering.	Rechtspraak.nl	Verrijkte uitspraak		
12	Rechtbank Rotterdam	04-11-2022	08-11-2022	9627641 \ CV EXPL 22-626	Civiel recht	Eerste aanleg - enkelvoudig	Geldvordering.	Rechtspraak.nl	Verrijkte uitspraak		
13	Rechtbank Rotterdam	04-11-2022	08-11-2022	9796506 \ CV EXPL 22-10567	Civiel recht	Eerste aanleg - enkelvoudig	Geldvordering.	Rechtspraak.nl	Verrijkte uitspraak		
14	Rechtbank Rotterdam	04-11-2022	08-11-2022	8697104 \ CV EXPL 20-27725	Civiel recht	Eerste aanleg - enkelvoudig	Kantonrechter komt terug op de verleende afstand van instantie. Na vermindering van eis resteert alleen nog een proceskostenveroordeling. Geen aanleiding om het voorstel van gedaagden te volgen om prejudiciële vragen aan de Hoge Raad voor te leggen over artikel 7:417 lid 2 en 3 BW.	Rechtspraak.nl	Verrijkte uitspraak		
15	Rechtbank Rotterdam	04-11-2022	08-11-2022	9932825 CV EXPL 22-18118	Civiel recht	Eerste aanleg - enkelvoudig	Opheffing beslag gevorderd in art. 223 Rv-incident. Levert 403-verklaring van buitenlandse vennootschap voldoende vervangende zekerheid op? Afwijzing.	Rechtspraak.nl	Verrijkte uitspraak		
16	Rechtbank Noord-Holland	04-11-2022	09-11-2022	C/15/324380 / FA RK 22-260	Personen- en familierecht	Eerste aanleg - enkelvoudig	Ontkenning vaderschap + gelijktijdige (voorwaardelijke) beslissing over gerechtelijke vaststelling ouderschap. Geslachtsnaam. IPR. Deze beslissing wijkt af van de richtlijn van de Expertgroep Adoptie en Overige Boek 1 zaken dat niet in één beschikking een beslissing wordt gegeven over zowel de gegrondverklaring van een ontkenning vaderschap als over de gerechtelijke vaststelling ouderschap. Deze richtlijn is opgesteld omdat de heersende mening is dat gerechtelijke vaststelling van het ouderschap een laatste mogelijkheid is voor het tot stand brengen van een familierechtelijke betrekking en dat deze rechtsfiguur niet aan de orde is zolang er de mogelijkheid bestaat van erkenning van het kind. Onder de door de moeder en de vader geschetste omstandigheden, zal de rechtbank het door de moeder en de vader gestelde belang volgen, te weten terugwerkende kracht bij gerechtelijke vaststelling ouderschap in tegenstelling tot erkenning, alsmede het nationaliteitsbelang. Daar komt bij dat in casu de genetische afstamming van de minderjarigen van de vader middels DNA-onderzoek is vastgesteld, terwijl deze vaststelling bij erkenning niet aan de orde is.	Rechtspraak.nl	Verrijkte uitspraak		
17	Rechtbank Den Haag	03-11-2022	04-11-2022	FTRK 22/702	Insolventierecht	Eerste aanleg - enkelvoudig	Afwijzing verzoek WSNP. Schulden niet te goeder trouw. Niet de verwachting dat verplichtingen uit regeling zullen worden nagekomen.	Rechtspraak.nl	Verrijkte uitspraak	Faillissementswet 284	
18	Rechtbank Oost-Brabant	03-11-2022	04-11-2022	9813556 22-1816	Civiel recht	"Bodemzaak
Eerste aanleg - enkelvoudig"	De vraag die in deze zaak centraal staat is of het ziekenhuis een patiënt voor een behandeling had moeten waarschuwen dat haar verzekering de kosten van de behandeling niet geheel dekte. Eiseres (het ziekenhuis) vindt dat de dekking van de zorgverzekering de verantwoordelijkheid van de patiënt is. Gedaagde (patiënt) vindt dat eiseres haar vooraf had moeten waarschuwen. Doordat gedaagde een goedkopere zorgverzekering heeft afgesloten waardoor zij een lagere premie betaalt worden niet alle kosten in alle ziekenhuizen vergoed. De kantonrechter is van oordeel dat het de verantwoordelijkheid van gedaagde is om te controleren of haar verzekering alle kosten van de behandeling dekt. Daarbij heeft gedaagde al eerder medische behandelingen bij eiseres ondergaan waarvoor zij ook een eigen bijdrage heeft moeten betalen.	Rechtspraak.nl	Verrijkte uitspraak		
19	Rechtbank Oost-Brabant	03-11-2022	09-11-2022	C/01/384508 / KG ZA 22-421	Civiel recht	Kort geding	vordering tot heraansluiting  na afsluiting elektriciteit ivm diefstal stroom ihkv opgerolde hennepkwekerij	Rechtspraak.nl	Verrijkte uitspraak		
20	Rechtbank Zeeland-West-Brabant	03-11-2022	09-11-2022	9905681 AZ VERZ 22-32	Civiel recht	Bodemzaak	Eindbeschikking na bewijslevering t.a.v. de loonvordering en ongerechtvaardigde verrijking.	Rechtspraak.nl	Verrijkte uitspraak		
21	Rechtbank Midden-Nederland	02-11-2022	02-11-2022	C/16/531092 / HA ZA 21-785	Civiel recht	Eerste aanleg - meervoudig	Afwijzing vordering van zorgkantoor Zilveren Kruis op zorgverlener Fundament tot terugbetaling van niet-verantwoorde pgb-gelden. De budgethouders hebben zelf geen schade geleden omdat zij de vordering die Zilveren Kruis op hen heeft, niet hoeven terug te betalen. Zij hebben daarom geen vordering op de Fundament die zij aan Zilveren Kruis konden cederen en op grond waarvan Zilveren Kruis terugbetaling van de pgb-gelden van de Fundament kan vorderen. De vordering van Zilveren Kruis op de Fundament uit onrechtmatige daad slaagt ook niet, omdat niet is gebleken dat het Zorginstituut of de NZa subsidie van Zilveren Kruis hebben teruggevorderd of dat in de toekomst zullen doen. Gelet hierop staat niet vast dat Zilveren Kruis schade heeft geleden of zal lijden.	Rechtspraak.nl	Verrijkte uitspraak		
22	Rechtbank Overijssel	02-11-2022	02-11-2022	10138179 \ CV EXPL  22-3588	Civiel recht	Kort geding	Ontruiming aanleunwoning in kort geding toegewezen vanwege strafbaar en volstrekt ontoelaatbaar gedrag huurder. Opleggen locatie- en gebiedsverbod eveneens gerechtvaardigd.	Rechtspraak.nl	Verrijkte uitspraak		
23	Rechtbank Rotterdam	02-11-2022	03-11-2022	C/10/637117 / HA ZA 22-348	Verbintenissenrecht	Eerste aanleg - enkelvoudig	Artikel 6:225 lid 3 BW vereist dat naast een verwijzing naar de eigen voorwaarden tevens en uitdrukkelijk de toepasselijkheid van de algemene voorwaarden van de ander van de hand wordt gewezen.	Rechtspraak.nl	Verrijkte uitspraak		
24	Rechtbank Den Haag	02-11-2022	03-11-2022	C/09/615493 / HA ZA 21-660	Civiel recht	Eerste aanleg - enkelvoudig	Begaclaim. Vraag of Staat aansprakelijk is o.g.v. onrechtmatige daad (6:162 BW), doordat eiser gedetineerd heeft gezeten in een strafzaak waarin hij is vrijgesproken. Sprake van onrechtmatig rechtspraak? Vorderingen afgewezen.	Rechtspraak.nl	Verrijkte uitspraak		
25	Rechtbank Amsterdam	02-11-2022	04-11-2022	C/13/711768 / HA ZA 21-1105	Civiel recht	Eerste aanleg - enkelvoudig	Blokker B.V. moet bijna 125.000 euro schadevergoeding betalen aan de voormalig exploitant van een Blokkerfiliaal. Dat heeft de rechtbank geoordeeld.	Rechtspraak.nl	Verrijkte uitspraak		
26	Rechtbank Amsterdam	02-11-2022	04-11-2022	C/13/720872 / KG RK 22-1103 AB/MB	Civiel recht	Kort geding	De voorzieningenrechter heeft een verzoek van een Russische schuldeiser om aandelen over te dragen voor 1 euro, afgewezen.	Rechtspraak.nl	Verrijkte uitspraak		
27	Rechtbank Rotterdam	02-11-2022	07-11-2022	C/10/645244 / KG ZA 22-813	Civiel recht	Kort geding	Kort geding. Contactverbod in conventie en reconventie gevorderd. Vorderingen over en weer afgewezen. De buurtgenoten moeten in staat zijn om elkaar, zoals in de mediation afgesproken, te negeren en uit te gaan van leven en laten leven.	Rechtspraak.nl	Verrijkte uitspraak		
28	Rechtbank Zeeland-West-Brabant	02-11-2022	07-11-2022	C/02/398281/ FA RK 22-2503	Personen- en familierecht	"Eerste aanleg - enkelvoudig
Beschikking"	Verzoek wijziging partneralimentatie. Wijziging van omstandigheden omdat vrouw geen informatie heeft verstrekt over haar inspanningsverplichting. Onvoldoende onderbouwing dat gezondheidsklachten haar beperken. Fictief inkomen leidt tot een verlaging van de partneralimentatie.	Rechtspraak.nl	Verrijkte uitspraak		
29	Rechtbank Amsterdam	02-11-2022	07-11-2022	C/13/711123 / HA ZA 21-1075	Personen- en familierecht	Eerste aanleg - enkelvoudig	Verzekerinsrecht, erfrecht, huwelijksgoederenrecht. Ex-echtgenoot was gerechtigd overlijdensrisicoverzekering te veranderen ORV is geen boedelbestanddeel van de huwelijksgemeenschap.	Rechtspraak.nl	Verrijkte uitspraak		
30	Rechtbank Noord-Holland	02-11-2022	07-11-2022	322939 / HA ZA 21-642	Civiel recht	Bodemzaak	Oud-fractievoorzitter Forza! in de gemeenteraad Haarlemmermeer heeft rekening-courant verhouding onderhouden met de bankrekening. Hij wordt verantwoordelijk gehouden voor het kastekort en moet de door de gemeente  teruggevorderde fractievergoeding voldoen	Rechtspraak.nl	Verrijkte uitspraak		
31	Rechtbank Noord-Holland	02-11-2022	07-11-2022	9325058	Verbintenissenrecht	Bodemzaak	Vervroegde aankomst, Montreal toch van toepassing want niet gebleken dat de passagiers na annulering alsnog zonder vertraging op de eindbestemming hadden kunnen aankomen. Vervoerder heeft niet de mogelijkheid gehad een alternatieve vlucht te regelen.	Rechtspraak.nl	Verrijkte uitspraak		
32	Rechtbank Noord-Nederland	02-11-2022	08-11-2022	185981	Personen- en familierecht	"Eerste aanleg - enkelvoudig
Op tegenspraak"	1:253ha BW. Meerderjarig verklaring. Gezag van rechtswege na meerderjarig verklaring.	Rechtspraak.nl	Verrijkte uitspraak		
33	Rechtbank Gelderland	02-11-2022	09-11-2022	C/05/399948 / HA ZA 22-76	Verbintenissenrecht	"Eerste aanleg - enkelvoudig
Op tegenspraak
Tussenuitspraak"	Geschil onderaannemer - hoofdaannemer. Omvang opdracht. Meerwerk en nakoming waarschuwingsverplichting (7:755 BW). Bewijsopdracht aan onderaannemer.	Rechtspraak.nl	Verrijkte uitspraak		
34	Rechtbank Gelderland	02-11-2022	09-11-2022	C/05/386266 / HA ZA 21-171	Verbintenissenrecht	Eerste aanleg - enkelvoudig	Afnemer is boete verschuldigd vanwege tussentijds annuleren overeenkomst voor leveren en installeren zonnepanelen. Geen sprake van opzegging door leverancier of beëindiging met wederzijds goedvinden. Uitleg boetebepaling AV. Matiging boete.	Rechtspraak.nl	Verrijkte uitspraak		
35	Rechtbank Gelderland	02-11-2022	09-11-2022	396330	Intellectueel-eigendomsrecht	Eerste aanleg - enkelvoudig	Auteursrecht op flessenwarmers. Uit vormgevingserfgoed blijkt de keuzevrijheid van de maker. Ontwerpkeuzes niet technisch bepaald, triviaal of banaal. Verbod voor de gehele Europese Unie.	Rechtspraak.nl	Verrijkte uitspraak		
36	Rechtbank Gelderland	02-11-2022	09-11-2022	C/05/399746 / HZ ZA 22-54	Civiel recht	Eerste aanleg - enkelvoudig	Vervoersrecht. Afzender vordert schadevergoeding van vervoerder wegens ladingdiefstal. Rechter wijst vorderingen toe tot CMR-limiet. Geen opzet. Geen overmacht. Geen schending verzwaarde motiveringsplicht.	Rechtspraak.nl	Verrijkte uitspraak		
37	Rechtbank Gelderland	02-11-2022	09-11-2022	C/05/406325 / HZ ZA 22-216	Verbintenissenrecht	Eerste aanleg - enkelvoudig	Vordering verklaring voor recht dat besluit van VvE nietig is wegens strijd met art.5:127 lid 3 jo 5:129 lid 1 jo 2:14 BW.	Rechtspraak.nl	Verrijkte uitspraak		
38	Rechtbank Gelderland	02-11-2022	09-11-2022	C/05/389893 / HZ ZA 21-234	Civiel recht	Eerste aanleg - enkelvoudig	Vervolg op ECLI:NL:RBGEL:2022:2322. Tussenvonnis na (tegen)bewijsopdracht. Partijen moeten zich nader uitlaten over afrekening over bepaalde zaken in de geërfde woning en de gevolgen daarvan voor de afrekening cfm de meerwaardeclausule uit 1920 en 1961.	Rechtspraak.nl	Verrijkte uitspraak		
39	Rechtbank Zeeland-West-Brabant	02-11-2022	09-11-2022	9815823 CV EXPL 22-1423	Civiel recht	Bodemzaak	Art 15 WAM. Geen schending van art 7:928 BW mededelingsplicht. Ingangsdatum van de verzekeringspolis is de datum van de aanrijding, zodat de verplichte mededelingsplicht is geëindigd voordat de schade werd gereden. Sprake van een verzekering met dekking.	Rechtspraak.nl	Verrijkte uitspraak		
40	Rechtbank Noord-Holland	02-11-2022	09-11-2022	C/15/327948 / FA RK 22-2170	Personen- en familierecht	Eerste aanleg - enkelvoudig	Beëindiging gezamenlijk gezag is in het belang van de minderjarigen noodzakelijk. De vader is geëmigreerd naar Curaçao en heeft daardoor letterlijk en figuurlijk een ouderrol op afstand en is weinig betrokken bij gezagsbeslissingen.De ouders hebben een goede verstandhouding, de moeder informeert de vader over belangrijke zaken en de vader was het eens met het verzoek van de moeder om eenhoofdig gezag.	Rechtspraak.nl	Verrijkte uitspraak		
41	Rechtbank Gelderland	02-11-2022	09-11-2022	C/05/406130 / HA ZA 22-297	Burgerlijk procesrecht	Eerste aanleg - enkelvoudig	Burgerlijk Procesrecht. Bevoegdheidsincident. Verwijzing op grond van het Zaaksverdelingsreglement in combinatie met het Besluit interne relatieve bevoegdheid.	Rechtspraak.nl	Verrijkte uitspraak		
42	Rechtbank Noord-Holland	02-11-2022	09-11-2022	C/15/331624 / FA RK 22-4155	Personen- en familierecht	Eerste aanleg - enkelvoudig	De minderjarigen worden toevertrouwd aan de vrouw en krijgen een zorgregeling met de man in kader van voorlopige voorzieningen. Het verzoek van de man om een birdnestingsregeling te bepalen wordt afgewezen. De communicatie tussen partijen is verstoord en gelet op het werk van partijen heeft de vrouw voorlopig meer mogelijkheden om voor de minderjarigen te zorgen dan de man. Nu de man de woning moet verlaten en voorlopig dubbele woonlasten zal hebben, kan hij geen partnerbijdrage betalen.	Rechtspraak.nl	Verrijkte uitspraak		
43	Rechtbank Rotterdam	02-11-2022	09-11-2022	C/10/637654 / HA ZA 22-373	Burgerlijk procesrecht	Eerste aanleg - enkelvoudig	Tussenvonnis. Vervolg op vonnis in het incident van 17 augustus 2022 (C/10/637654/HA ZA 22-373). Genoegzaam zekerheid gesteld voor proceskosten? Storting op derdengeldrekening eigen advocaat met borgstelling.	Rechtspraak.nl	Verrijkte uitspraak		
44	Rechtbank Rotterdam	01-11-2022	01-11-2022	C/10/635315 / FA RK 22-1904 en C/10/639926 / FA RK 22-4157	Personen- en familierecht	Beschikking	Voogdij opgedragen aan gecertificeerde instelling. Neutraliteit en deskundigheid zijn nodig, mede vanwege de spanningen in de familie. De minderjarigen hebben er belang bij dat de hele familie er in de toekomst voor hen is, ook als er onenigheid is over wie het beste voor hen kan zorgen.	Rechtspraak.nl	Verrijkte uitspraak		
45	Rechtbank Midden-Nederland	01-11-2022	01-11-2022	10096409 / LV EXPL  22-30	Civiel recht	Kort geding	Geen duurzame gemeenschappelijke huishouding in de zin van artikel 7:268 lid 2 BW, zodat de zoon van de overleden huurders de woning dient te ontruimen. De voorts gevorderde huurachterstand wordt op grond van artikel 7:268 lid 5 BW toegewezen.	Rechtspraak.nl	Verrijkte uitspraak		
46	Rechtbank Den Haag	01-11-2022	02-11-2022	C/09/634531 / KG ZA 22-786	Civiel recht	Kort geding	Kort geding. Europese niet-openbare aanbesteding. De voorzieningenrechter gebiedt de aanbestedende dienst om haar oordeel dat de inschrijving van Vermeulen geldig is, alsnog deugdelijk te motiveren.	Rechtspraak.nl	Verrijkte uitspraak		
47	Rechtbank Overijssel	01-11-2022	03-11-2022	C/08/286304 / KG ZA 22-211	Civiel recht	Kort geding	Het gaat in deze zaak om de levering van 77 iPads. Gedaagde stelt dat deze iPads door problemen bij de verzending niet bij eiseres zijn geleverd. In kort geding vordert eiseres levering van deze iPads. De vordering wordt door gedaagde niet betwist en zal worden toegewezen.	Rechtspraak.nl	Verrijkte uitspraak		
48	Rechtbank Gelderland	01-11-2022	08-11-2022	C/05/404505 / HA RK 22-99	Verbintenissenrecht	Beschikking	Art.35 UAVG-verzoek van UBO van twee stichtingen, verzoek om inzage en informatie ex art. 15 en 22 AVG (geautomatiseerde besluitvorming en profilering), verweerder is betaaldienstverlener die de dienstverlening aan twee stichtingen heeft opgezegd.	Rechtspraak.nl	Verrijkte uitspraak		
49	Rechtbank Overijssel	01-11-2022	08-11-2022	9680063 \ CV EXPL  22-489	Civiel recht	Eerste aanleg - enkelvoudig	Eiser heeft werkzaamheden uitgevoerd voor gedaagde en heeft daarvoor een factuur naar gedaagde verstuurd. Gedaagde wil deze factuur niet betalen omdat eiser niet transparant geweest is over de kosten die hij in rekening brengt. De kantonrechter oordeelt dat eiser niet voldaan heeft aan op hem rustende informatieverplichtingen en is daarom van plan als sanctie de betalingsverplichting van gedaagde met 25% te verminderen.	Rechtspraak.nl	Verrijkte uitspraak		
50	Rechtbank Gelderland	01-11-2022	08-11-2022	C/05/408372 / KG ZA 22-285	Civiel recht	Kort geding	Kort geding. Derde juridische procedure tussen kinderen over het (niet) verkopen van de woning van moeder, die elders wordt verzorgd. Eiseres in conventie is niet vertegenwoordigingsbevoegd ten aanzien van de woning en is in haar vorderingen niet-ontvankelijk. In reconventie staat artikel 236 lid 1 Rv niet aan toewijsbaarheid in de weg en is geen sprake van misbruik van procesrecht. Belangenafweging. Vordering ten aanzien van aan moeder geadresseerde post te ruim en onbepaald en onvoldoende onderbouwd. Afwijzing reconventionele vorderingen.	Rechtspraak.nl	Verrijkte uitspraak		
51	Rechtbank Gelderland	01-11-2022	08-11-2022	C/05/409197 / KG ZA 22-300	Civiel recht	Kort geding	Kort geding. Onderhandse uitgifte grond in erfpacht. Uitgifteprocedure tussentijds gestaakt vanwege het Didam-arrest. Gedaagde mocht voorbereidende contractsbesprekingen over gronduitgifte staken. Geen schending vertrouwensbeginsel. Vordering afgewezen.	Rechtspraak.nl	Verrijkte uitspraak		
52	Rechtbank Zeeland-West-Brabant	01-11-2022	09-11-2022	C/02/396509 FA RK 22-1622	Personen- en familierecht	Rekestprocedure	Vaststelling hoofdverblijfplaats en wijziging zorgregeling in verhouding tot schorsingsvoorwaarden voorlopige hechtenis minderjarige. Afwijzing onderzoek raad voor de kinderbescherming. Verwijzing geldvordering naar kantonrechter	Rechtspraak.nl	Verrijkte uitspraak		
53	Rechtbank Overijssel	01-11-2022	09-11-2022	10094422 \ EJ VERZ  22-231	Civiel recht	"Eerste aanleg - enkelvoudig
Beschikking"	Betreft een verzoek om ontruimingsbescherming ex artikel 7:230a BW. De kantonrechter wijst de vordering deels toe, en verlengt de ontruimingstermijn met enkele maanden. Verhuurder heeft zelf al enig uitstel toegestaan en de belangen van de huurder om nog niet te hoeven ontruimen wegen (korte tijd) zwaarder dan het belang van de verhuurder bij ontruiming. Het verzoek van de verhuurder om gedurende de verlengde ontruimingstermijn een hogere gebruiksvergoeding toe te kennen, wordt afgewezen.	Rechtspraak.nl	Verrijkte uitspraak		
54	Rechtbank Noord-Nederland	01-11-2022	09-11-2022	9275599	Civiel recht	"Bodemzaak
Eerste en enige aanleg
Proceskostenveroordeling
Schadevergoedingsuitspraak
Op tegenspraak"	Wateroverlast na hevige regenval. Lekkage in kelder. Eiser stelt gedaagde, een verderop wonende buurman, aansprakelijk voor de schade op grond van onrechtmatige daad. Gedaagde heeft ontheffing van het waterschap om perceel te bemalen, maar heeft de bemalingsinstallatie tijdelijk buiten bedrijf gesteld in verband met verbouwingswerkzaamheden	Rechtspraak.nl	Verrijkte uitspraak		
55	Rechtbank Rotterdam	31-10-2022	31-10-2022	C/10/638164 / HA ZA 22-404	Civiel recht	Eerste aanleg - enkelvoudig	Onderaanneming. Onderaannemer vordert betaling van facturen door aannemer. Aannemer stelt schade te hebben geleden door werkzaamheden van onderaannemer en doet een beroep op verrekening. Beroep op verrekening slaagt niet.	Rechtspraak.nl	Verrijkte uitspraak		
56	Rechtbank Overijssel	31-10-2022	01-11-2022	C/08/285524 / KG RK 22-378	Civiel recht	Wraking	De wrakingskamer overweegt dat wraking een verzoek is om een voor de behandeling van de zaak aangewezen rechter doen vervangen door een andere rechter. Een verzoek tot wraking kan in beginsel in elke stand van de procedure worden gedaan, mits de behandeling van de zaak nog niet is geëindigd door het wijzen van een einduitspraak. De onpartijdigheid kan daarom alleen vóór de beslissing worden getoetst, maar niet meer tijdens of naderhand. Op basis van gemeld proces-verbaal van de zitting van 31 augustus 2022 stelt de wrakingskamer vast dat de rechter de mondelinge behandeling van de Mulder beroepszaak van verzoeker had gesloten en daarna direct was begonnen met het uitspreken van (de motivering van) zijn uitspraak toen hij door verzoeker werd gewraakt. Onder deze omstandigheden is de wrakingskamer van oordeel dat het verzoek pas is gedaan na het tijdstip waarop in de hoofdzaak uitspraak werd gedaan, een en ander als bedoeld in artikel 5 lid 2 sub d van het Wrakingsprotocol. Dit betekent dat het verzoek ongegrond is.	Rechtspraak.nl	Verrijkte uitspraak		
